id,title,note,excerpt,url,tags,created,cover,highlights,favorite
1281128792,MaxJax | Official MaxJax Portable Two-Post Car Lift,,MaxJax is the unique portable two-post car lift design that offers greater versatility and serviceability when compared to traditional garage lifting systems.,https://www.maxjax.com/,"Automotive, Parts, Tools",2025-08-03T04:02:06.800Z,https://www.maxjax.com/cdn-cgi/image/format=auto/sfsites/c/cms/delivery/media/MCFGMMOYEJ2NF4TIBJLKYFOBSGLY?channelId=0apUa00000002uf,,false
1281128584,CarCareKiosk – Free How-to Videos to Fix Your Car,,Video tutorials for DIY car maintenance with step-by-step directions for free how-to lifehacks for car maintenance. See how to change burnt out bulbs and more!,https://www.carcarekiosk.com/,"Vehicle, Repair",2025-08-03T04:00:59.276Z,https://static.carcarekiosk.com/images/makes/Acura.png,,false
1281128518,VIM Tools,,,https://vimtools.com/,Tools,2025-08-03T04:00:37.381Z,https://vimtools.com/wp-content/uploads/2022/09/WSA100-1024x444.jpg,,false
1281128463,Free Car Service Manuals from Operation CHARM — No strings attached!,,"Operation CHARM provides completely free repair/service/workshop manuals for over 50,000 models of cars and trucks manufactured 1982-2013. No sign-up or paywall.",https://charm.li/,"Vehicle, Data Dumps, Tools, Parts",2025-08-03T04:00:21.389Z,https://rdl.ink/render/https%3A%2F%2Fcharm.li%2F,,false
1281128401,Shadow Dash MS,,"Released for Final Round Beta Testing. All new for Android, dashboards and data logging with style. Tunerstudio Dashboard Style and flexibility Shadow Logger si",https://www.tunerstudio.com/index.php/products/shadowdashmsmenu,"Vehicle, Tools",2025-08-03T04:00:05.708Z,https://www.tunerstudio.com/images/ShadowDash/homeScreenPortraitSm.png,,false
1281128303,Vehicle ratings,,IIHS-HLDI tests evaluate two aspects of safety: crashworthiness — how well a vehicle protects its occupants in a crash — and crash avoidance and mitigation — technology that can prevent a crash or lessen its severity.,https://www.iihs.org/ratings,"Vehicle, Ratings",2025-08-03T03:59:37.167Z,https://www.iihs.org/media/7c25a7a8-a4c2-4ffa-9573-677541ff6f28/bxip-w/Ratings/Landing%20page/landing-awards.png,,false
1281128242,2023 NEW LED Headlight Bulb - Up To 50% Off,,Upgrade your headlights today with Boslla LED bulbs and get 800% brighter!,https://www.boslla.com/,"Vehicle, Parts",2025-08-03T03:59:22.739Z,https://www.boslla.com/wp-content/uploads/2024/04/Boslla-Chameleon-H11-LED-Headlight-Bulbs.jpg,,false
1281128193,PSU Tier List rev. 17.0g - Cultists Network,,PSU Tier List will help you to choose the best PSU out of hundreds of models on the market. From budget to the highest end Power Supplies.,https://cultists.network/140/psu-tier-list/,"Computers, Parts",2025-08-03T03:59:08.226Z,https://cultists.network/wp-content/uploads/2021/08/psutierlist.jpg,,false
1281128171,Dolphin Emulator - GameCube/Wii games on PC,,"Official website of Dolphin, the GameCube and Wii emulator. Download the latest version (2506-320) now or ask questions on our forums for help.",https://dolphin-emu.org/,"Gaming, Emulators",2025-08-03T03:58:58.015Z,https://dolphin-emu.org/m/user/cache/46/cf/46cf72af50e010f421de1636428214d9.jpg,,false
1281128134,Home | PCSX2,,An Open-Source Playstation 2 Emulator,https://pcsx2.net/,"Gaming, Emulators",2025-08-03T03:58:49.006Z,https://pcsx2.net/img/logo.webp,,false
1281128081,The Discord Enhancement Project,,BetterDiscord extends the functionality of DiscordApp by enhancing it with new features.,https://betterdiscord.app/plugins,"Discord, Plugins",2025-08-03T03:58:29.983Z,https://betterdiscord.app/resources/branding/logo_solid.png,,false
1281127985,SteamDB,,SteamDB is a database of everything on Steam.,https://steamdb.info/,"Gaming, Data Dumps",2025-08-03T03:58:07.976Z,https://steamdb.info/static/logos/512px.png,,false
1281127842,IsThereAnyDeal,,,https://isthereanydeal.com/,"Gaming, Sales",2025-08-03T03:57:30.644Z,https://isthereanydeal.com/public/assets/socials/og_twitter2.png,,false
1281127803,"Game Deals - Find Discounted Video Games, Cheap Steam Keys, CD Keys & Game Codes - Compare & Track Prices | GG.deals",,"Compare prices of video games from almost 60 stores, find the best game deals online. CD keys for all PlayStation, Xbox, Nintendo Switch and PC games on the market at the best price!",https://gg.deals/,"Gaming, Sales",2025-08-03T03:57:20.455Z,https://img.gg.deals/9c/57/e5b4729a12a9558f8f0f162d87151cde5c32_1920xt1080_Q100.png,,false
1281127777,Learn VIM while playing a game - VIM Adventures,,"VIM Adventures is an online game based on VIM's keyboard shortcuts. It's the ""Zelda meets text editing"" game. So come have some fun and learn some VIM!",https://vim-adventures.com/,"Neovim, Learning",2025-08-03T03:57:08.179Z,https://vim-adventures.com/images/FB%20Site%20Thumbnail%201.jpg,,false
1281127718,Learn REST API Design - REST API Tutorial,,Learn REST API Design,https://www.restapitutorial.com/,"Learning, Programming",2025-08-03T03:56:50.860Z,https://www.restapitutorial.com/images/design_tools.jpg,,false
1281127679,Awesome Cheatsheets,,Designed for the ones who enjoy dark interfaces as much as we do. Using the best UX practices for great conversion rates.,https://lecoupa.github.io/awesome-cheatsheets/,"Programming, Cheatsheet, Tools",2025-08-03T03:56:39.068Z,https://lecoupa.github.io/awesome-cheatsheets//images/common/logo@2x.png,,false
1281127632,SS64 Command line reference,,,https://ss64.com/,"Shell, Tools",2025-08-03T03:56:23.824Z,https://ss64.com/apple-touch-icon.png,,false
1281127595,ShellCheck – shell script analysis tool,,ShellCheck finds bugs in your shell scripts,https://www.shellcheck.net/,"Shell, Tools",2025-08-03T03:56:13.067Z,https://www.shellcheck.net/shellcheck.png,,false
1281127468,Python Cheatsheet,,The Python Cheatsheet,https://www.pythoncheatsheet.org/,"Python, Cheatsheet, Programming, Learning, Tools",2025-08-03T03:55:52.692Z,https://raw.githubusercontent.com/wilfredinni/python-cheatsheet/master/public/screenshots/dark.png,,false
1281127403,Python Tutor - Python Online Compiler with Visual AI Help,,,https://pythontutor.com/,"Programming, Learning",2025-08-03T03:55:31.759Z,https://pythontutor.com/ai-tutor-homepage-example.png,,false
1281127377,PyFormat: Using % and .format() for great good!,,,https://pyformat.info/,"Python, Tools",2025-08-03T03:55:22.690Z,https://rdl.ink/render/https%3A%2F%2Fpyformat.info%2F,,false
1281127330,Vim Awesome,,Awesome Vim plugins from across the universe,https://vimawesome.com/,"Neovim, Plugins",2025-08-03T03:55:10.366Z,https://vimawesome.com/static/img/og.png,,false
1281127290,Learn Vim,,Learning Vim and Vimscript doesn't have to be hard. This is the guide that you're looking for.,https://learnvim.irian.to/,"Learning, Neovim",2025-08-03T03:54:59.134Z,https://learnvim.irian.to/banner.png,,false
1281127185,RegEx Library | UI Bakery,,Regular expressions (RegEx) are powerful tools used in programming for pattern matching and data manipulation. Here's an outline of what such a library could include:,https://uibakery.io/regex-library,"Programming, Tools, Regex",2025-08-03T03:54:28.861Z,https://cdn.prod.website-files.com/653a8b0e56e4a44a90d64931/659ed2f56dbcf48f729b3094_UIb%20(2).png,,false
1281127118,Regulex：JavaScript Regular Expression Visualizer,,,https://jex.im/regulex/#!flags=&re=%5E(a%7Cb)*%3F%24,"Regex, Tools",2025-08-03T03:54:14.007Z,https://rdl.ink/render/https%3A%2F%2Fjex.im%2Fregulex%2F%23!flags%3D%26re%3D%255E(a%257Cb)*%253F%2524,,false
1281127074,"Debuggex: Online visual regex tester. JavaScript, Python, and PCRE.",,"Test your regex by visualizing it with a live editor. JavaScript, Python, and PCRE.",https://www.debuggex.com/,"Programming, Regex, Tools",2025-08-03T03:54:00.949Z,https://rdl.ink/render/https%3A%2F%2Fwww.debuggex.com%2F,,false
1281127030,"regex101: build, test, and debug regex",,"Regular expression tester with syntax highlighting, explanation, cheat sheet for PHP/PCRE, Python, GO, JavaScript, Java, C#/.NET, Rust.",https://regex101.com/,"Regex, Tools",2025-08-03T03:53:46.163Z,https://regex101.com/preview/,,false
1281126987,git - the simple guide - no deep shit!,,,https://rogerdudler.github.io/git-guide/,"Learning, Git",2025-08-03T03:53:34.669Z,https://rogerdudler.github.io/git-guide/img/arrow.png,,false
1281126881,"Oh Shit, Git!?!",,,https://ohshitgit.com/,"Git, Tools",2025-08-03T03:52:55.226Z,https://rdl.ink/render/https%3A%2F%2Fohshitgit.com%2F,,false
1281126858,git-annex,,,https://git-annex.branchable.com/,"Git, Tools",2025-08-03T03:52:43.950Z,https://rdl.ink/render/https%3A%2F%2Fgit-annex.branchable.com%2F,,false
1281126804,"FROM:latest, An opinionated Dockerfile linter.",,Review your Dockerfile to see if you have implemented the best practices.,https://www.fromlatest.io/#/,"Programming, Tools, Docker",2025-08-03T03:52:30.378Z,https://i.imgur.com/P0HOQZ8.png,,false
1281126710,Modern JavaScript Cheatsheet,,Cheatsheet for the JavaScript knowledge you will frequently encounter in modern projects.,https://mbeaudru.github.io/modern-js-cheatsheet/,"Programming, Learning, Cheatsheet, Javascript",2025-08-03T03:52:09.665Z,https://i.imgur.com/aexPxMb.png,,false
1281126636,SQLZoo,,,https://sqlzoo.net/wiki/SQL_Tutorial,"Programming, Learning, SQL",2025-08-03T03:51:49.116Z,https://rdl.ink/render/https%3A%2F%2Fsqlzoo.net%2Fwiki%2FSQL_Tutorial,,false
1281126604,Learn SQL for Data Analysis | SQL Tutorial for Data Analyst | bipp Analytics,,SQL Tutorial for Data Analysis shall help you use SQL to extract the right answers from the data. Learn SQL as a Data Analyst to analyze data and solve challenging problems.,https://bipp.io/sql-tutorial,"Programming, Learning, SQL",2025-08-03T03:51:39.889Z,https://rdl.ink/render/https%3A%2F%2Fbipp.io%2Fsql-tutorial,,false
1281126584,Knight Lab's SQL Murder Mystery,,Use SQL queries to solve the murder mystery. Suitable for beginners or experienced SQL sleuths.,https://mystery.knightlab.com/,"Programming, Learning, SQL",2025-08-03T03:51:30.490Z,http://mystery.knightlab.com/174092-clue-illustration.png,,false
1281126553,Select Star SQL,,,https://selectstarsql.com/,"Programming, Learning, SQL",2025-08-03T03:51:20.452Z,https://rdl.ink/render/https%3A%2F%2Fselectstarsql.com%2F,,false
1281126526,Learn SQL - Online SQL Terminal - Practice SQL Querys,,,https://www.sql-practice.com/,"Learning, Programming, SQL",2025-08-03T03:51:09.917Z,https://rdl.ink/render/https%3A%2F%2Fwww.sql-practice.com%2F,,false
1281126470,CSS Grid Cheat Sheet,,,https://alialaa.github.io/css-grid-cheat-sheet/,"Programming, Cheatsheet, CSS, Web",2025-08-03T03:50:51.319Z,https://rdl.ink/render/https%3A%2F%2Falialaa.github.io%2Fcss-grid-cheat-sheet%2F,,false
1281126419,CSS Diner,,A fun game to help you learn and practice CSS selectors.,https://flukeout.github.io/,"Programming, Learning, Web, CSS",2025-08-03T03:50:37.888Z,https://flukeout.github.io/images/fb-share.jpg,,false
1281126367,CSS-Tricks - A Website About Making Websites,,,https://css-tricks.com/,"Programming, Web, CSS",2025-08-03T03:50:25.607Z,https://i0.wp.com/css-tricks.com/wp-content/uploads/2021/12/default-social-css-tricks.png,,false
1281126317,CSS Reference,,"CSS Reference is a free visual guide to CSS. It features the most popular properties, and explains them with illustrated and animated examples.",https://cssreference.io/,"Learning, Programming, Web",2025-08-03T03:50:09.209Z,https://cssreference.io/images/css-reference-share.png,,false
1281126284,Easing Functions Cheat Sheet,,"Easing functions specify the speed of animation to make the movement more natural. Real objects don’t just move at a constant speed, and do not start and stop in an instant. This page helps you choose the right easing function.",https://easings.net/en,"Learning, Programming, Web",2025-08-03T03:49:58.572Z,https://easings.net/192.c6b79276.png,,false
1281126230,"HTML, CSS, and JavaScript Tutorials, References, and Articles | HTML Dog",,,https://htmldog.com/,"Learning, Programming, Web",2025-08-03T03:49:42.996Z,https://rdl.ink/render/https%3A%2F%2Fhtmldog.com%2F,,false
1281126170,"HTML5 Doctor, helping you implement HTML5 today",,,https://html5doctor.com/,"Programming, Web, Tools, Learning",2025-08-03T03:49:23.716Z,https://rdl.ink/render/https%3A%2F%2Fhtml5doctor.com%2F,,false
1281126109,Go by Example,,,https://gobyexample.com/,"Programming, Learning",2025-08-03T03:49:01.876Z,https://rdl.ink/render/https%3A%2F%2Fgobyexample.com%2F,,false
1281126081,scikit-learn: machine learning in Python — scikit-learn 1.7.1 documentation,,,https://scikit-learn.org/stable/index.html#,"Programming, Learning",2025-08-03T03:48:53.725Z,https://scikit-learn.org/stable/_images/sphx_glr_plot_classifier_comparison_001_carousel.png,,false
1281126032,The Architecture of Open Source Applications,,,https://aosabook.org/en/index.html,Open Source,2025-08-03T03:48:40.699Z,https://aosabook.org/static/cover1.jpg,,false
1281125938,Low Level Academy,,"Learn systems programming, the right way.",https://lowlevel.academy/,"Programming, Learning",2025-08-03T03:48:20.871Z,https://lowlevel.academy/assets/exercise-Bsj31Jfl.png,,false
1281123034,"RegExr: Learn, Build, & Test RegEx",,"RegExr is an online tool to learn, build, & test Regular Expressions (RegEx / RegExp).",https://regexr.com/,"Programming, Tools, Regex",2025-08-03T03:47:58.922Z,https://regexr.com/assets/card.png,,false
1281120969,Compiler Explorer,,"Compiler Explorer is an interactive online compiler which shows the assembly output of compiled C++, Rust, Go (and many more) code.",https://godbolt.org/,"Programming, Tools, Assembly",2025-08-03T03:47:39.054Z,https://github.com/compiler-explorer/infra/blob/main/logo/favicon.png?raw=true,,false
1281120553,OverAPI.com | Collecting all the cheat sheets,,"OverAPI.com is a site collecting all the cheatsheets,all!",https://overapi.com/,"Programming, Tools, Cheatsheet",2025-08-03T03:46:30.789Z,https://overapi.com/static/images/overapi-logo.png,,false
1281120388,Code Beautifier,,"Code Beautifier | Beautify JavaScript, CSS or HTML code with Beautifier.",https://freecodetools.org/beautifier/,"Programming, Tools, Web",2025-08-03T03:46:15.084Z,https://freecodetools.org/beautifier.png,,false
1281120236,Home · Kenney,,,https://kenney.nl/,"Programming, Gaming",2025-08-03T03:45:59.106Z,https://kenney.nl/data/img/kenney-promo.png,,false
1281120035,Code Snippet - Snipplr Social Repository,,,https://snipplr.com/,"Programming, Articles",2025-08-03T03:45:44.491Z,https://rdl.ink/render/https%3A%2F%2Fsnipplr.com%2F,,false
1281119959,Home | davidc.net,,,https://www.davidc.net/,"Networking, Learning, Programming",2025-08-03T03:45:13.359Z,https://rdl.ink/render/https%3A%2F%2Fwww.davidc.net%2F,,false
1281119917,Interactive visual CIDR and IP range calculator,,"Instantly compute and visualize CIDR subnets, IP ranges and masks. Free online tool for accurate network design, planning and IT education.",https://cidr.xyz/,"Networking, Tools",2025-08-03T03:44:57.407Z,https://cidr.xyz/og.webp,,false
1281119890,Ventoy,,"Ventoy is an open source tool to create bootable USB drive for ISO files. With ventoy, you don't need to format the disk again and again, you just need to copy the iso file to the USB drive and boot it.",https://www.ventoy.net/en/index.html,"ISO, Tools",2025-08-03T03:44:48.439Z,https://www.ventoy.net/static/img/donation_en.jpg,,false
1281119824,F-Droid Apps - Page 7,,All F-Droid Apps - Page 7 on AlternativeTo,https://alternativeto.net/platform/f-droid/?p=7,"Phone, Apps",2025-08-03T03:44:26.392Z,https://d4.alternativeto.net/RgDf1rqQKT0NH2IDS_IX2MklMj3FHIxvyR12Sd2O26w/fit/1200/630/no/0/YWJzOi8vZGlzdC9zdGF0aWMvZ2Z4L2FsdDItb2cucG5n.jpg,,false
1281119340,Smartphones secret codes and other hidden functions,,,https://mobilexfiles.com/,"Phone, Tools",2025-08-03T03:43:39.702Z,https://img.mobilexfiles.com/motorola_edge_5g_2022.jpg,,false
1281119298,Caido,,Caido aims to help security professionals and enthusiasts audit web applications with efficiency and ease.,https://caido.io/,"Web, Auditing, Cybersecurity",2025-08-03T03:43:22.022Z,https://caido.io/__og-image__/static/og.png,,false
1281119225,Free Web Development Resources,,This is a list of awesome web development resources. Add more!,https://web-dev-resources.com/list/#/,"Web, Tools, Programming",2025-08-03T03:42:53.876Z,https://rdl.ink/render/https%3A%2F%2Fweb-dev-resources.com%2Flist%2F%23%2F,,false
1281119172,Magic Tool AI - Free Online Tools,,A suite of free Productivity Tools designed to help you be more productive and efficient.,https://magictool.ai/tools/,"Tools, Websites",2025-08-03T03:42:30.935Z,https://www.magictool.ai/images/magictool-cover-og-1200x630.png,,false
1281119116,LittleSnippets.net - A free collection of CSS3/HTML snippets. New entries crafted and added daily.,,,https://littlesnippets.net/,Websites,2025-08-03T03:42:10.722Z,https://littlesnippets.net/images/snippet-260/1500/1583.jpg,,false
1281119056,Emoji Combos,,A database of emoji combinations!,https://emojicombos.com/,Emoji,2025-08-03T03:41:48.585Z,https://rdl.ink/render/https%3A%2F%2Femojicombos.com%2F,,false
1281119022,Status overview,,Realtime overview of issues and outages with all kinds of services. Having issues? We help you find out what is wrong.,https://downdetector.com/,"Websites, Tools",2025-08-03T03:41:37.197Z,https://cdn2.downdetector.com/5371262976242c0/images/Downdetector-OG.png,,false
1281118953,Similarsites.com - Easily Explore alternative websites,,"Discover the best websites and explore competitor and related sites with Similarsites.com, the extension that enables you to browse associated content.",https://www.similarsites.com/,Websites,2025-08-03T03:41:15.346Z,https://site-images.similarcdn.com/image?url=nohat.cc&t=1&h=faab8237b93b984c217aee89b40a89672f699361a77ab7152f80b4bea4c60017,,false
1281118900,Tiny URL | Free Short URL Redirects with Tinycc,,"Changes a big URL into tiny URL. With link editing, detailed click statistics, QR Codes and Custom Domains.",https://tiny.cc/,"Tools, URL",2025-08-03T03:40:58.652Z,https://tiny.cc/public/images/newlogo2.svg,,false
1281118865,Online Calculators & Tools - RapidTables.com,,"Online reference and tools - calculators, converters, math, electricity, web design",https://www.rapidtables.com/,"Mathmatics, Tools",2025-08-03T03:40:46.548Z,https://rdl.ink/render/https%3A%2F%2Fwww.rapidtables.com%2F,,false
1281118823,"\""Cymath",,"\""Solve",https://www.cymath.com/,"Cheatsheet, Mathmatics, Tools",2025-08-03T03:40:33.084Z,http://www.cymath.com/img/cymath_square.gif,,false
1281118794,LibHunt - Trending open-source projects and their alternatives,,,https://www.libhunt.com/,Open Source,2025-08-03T03:40:20.066Z,https://cdn-b.libhunt.com/assets/logo/logo-og-ed809256db5b35139bc05c225c0616a376d0c37b00af28e0e797f1cacccdfa48.png,,false
1281118760,Open Source Alternatives To Proprietary Software,,The world's largest directory for open source software. Discover 500+ popular open source alternatives to proprietary software products. 100% free.,https://www.opensourcealternative.to/,Open Source,2025-08-03T03:40:08.771Z,https://lafptocsuil8sakp.public.blob.vercel-storage.com/og-8hD3z53UHLHVtSFHRJlooI2zNiPKaN.png,,false
1281118727,AT&T Breach Check - Pentester.com,,,https://att.pentester.com/,"Cybersecurity, Data Dumps",2025-08-03T03:39:55.110Z,https://i.ibb.co/9TYYZQV/att.jpg,,false
1281118693,Have I Been Pwned: Check if your email address has been exposed in a data breach,,Have I Been Pwned allows you to check whether your email address has been exposed in a data breach.,https://haveibeenpwned.com/,"Cybersecurity, Data Dumps",2025-08-03T03:39:42.573Z,https://haveibeenpwned.com/Images/OpenGraphPreview.jpg,,false
1281118658,Iowa License Plate Lookup | StateRecords.org,,"Iowa license plates are vehicle registration plates issued by the state Department of Motor Vehicle. Learn the features of Iowa license plates, how to get license plates in Iowa, and how to use license plates to obtain information about a vehicle and its owner in Iowa; Plus, the eligiblity requirements for obtaining license plate information per Iowa state law",https://iowa.staterecords.org/licenseplate,"Vehicle, OSINT",2025-08-03T03:39:31.412Z,https://storage.googleapis.com/state-records-bucket/media/Iowa_0bbb87dc7d/Iowa_0bbb87dc7d.jpeg,,false
1281118574,Website technology checker,,"All-in-one platform for website technology profiling, security scanning, and real-time monitoring. Track over 48,426 technologies across 120 million websites. Download targeted website lists by tech stack for sales and marketing campaigns.",https://webtechsurvey.com/,"Search Engine, DNS",2025-08-03T03:39:01.318Z,https://webtechsurvey.com/s/img/WTSLogo_180x180.png,,false
1281118528,Whois.com - Free Whois Lookup,,Whois Domain Name & IP lookup service to search the whois database for verified registration information,https://www.whois.com/whois/,"Search Engine, DNS",2025-08-03T03:38:49.234Z,https://www.whois.com/images/twimg.png,,false
1281118478,WHOIS API | WHOIS Lookup API | Domain WHOIS API,,WHOIS API lets you quickly lookup a domain name's WHOIS data. You get fully parsed WHOIS fields in XML or JSON format at just $2 per 1000 domains!,https://www.whoxy.com/,"Search Engine, DNS",2025-08-03T03:38:33.510Z,https://www.whoxy.com/images/low_price_guarantee.png,,false
1281118341,WiGLE: Wireless Network Mapping,,"Maps and database of 802.11 wireless networks, with statistics, submitted by wardrivers, netstumblers, and net huggers.",https://wigle.net/,"OSINT, Networking",2025-08-03T03:37:47.619Z,https://rdl.ink/render/https%3A%2F%2Fwigle.net%2F,,false
1281117981,WhatsMyName Web,,,https://whatsmyname.app/?q=john,"OSINT, People",2025-08-03T03:36:00.489Z,https://github.com/WebBreacher/WhatsMyName/blob/main/whatsmyname.png?raw=true,,false
1281117921,Home : Open Corporates,,"Access fresh, standardized, and auditable legal-entity data from 140+ jurisdictions. Trust OpenCorporates for reliable company information.",https://opencorporates.com/,"OSINT, Company",2025-08-03T03:35:38.102Z,https://opencorporates.com/wp-content/uploads/2023/03/opencorporates-favicon.png,,false
1281117834,Truecaller - Leading Global Caller ID & Call Blocking App,,We have identified 3.2 trillion unknown calls & helped in blocking 56 billion spam calls in 2024. Download the Truecaller app for free today for safer communication!,https://www.truecaller.com/,"Apps, Phone",2025-08-03T03:35:13.117Z,https://www.truecaller.com/open-graph.jpg,,false
1281117744,Find out who called - Sync.ME,,Search any phone number worldwide and block unwanted spam calls.,https://sync.me/,"OSINT, Phone",2025-08-03T03:34:38.482Z,https://sync.me/ogImg.png,,false
1281117682,Fast People Search - Free People Search with FastPeopleSearch.io,,FastPeopleSearch.io offers quick people search & finder tools that are 100% free. Check out our free people search service to find people quickly and receive detailed search results today!,https://fastpeoplesearch.io/,"OSINT, People",2025-08-03T03:34:23.511Z,https://fastpeoplesearch.io/cdn/_next/static/images/search-pic.webp,,false
1281117397,Home | Bellingcat's Online Investigation Toolkit,,A toolkit for open source researchers,https://bellingcat.gitbook.io/toolkit/,"OSINT, Tools",2025-08-03T03:32:55.915Z,https://bellingcat.gitbook.io/toolkit/~gitbook/image?url=https%3A%2F%2F1607018381-files.gitbook.io%2F%7E%2Ffiles%2Fv0%2Fb%2Fgitbook-x-prod.appspot.com%2Fo%2Fspaces%252FFuL0vtRVpXHiKZgFkMFR%252Fuploads%252Fgit-blob-22a2d88a2a66e1049ab8478737bea2ae24a81d1d%252FBellingcat_Toolkit_Ann_Kiernan%2520stretched.png%3Falt%3Dmedia&width=1248&dpr=4&quality=100&sign=7789fe6d&sv=2,,false
1281117335,OSINT Investigations,,Intelligence Analytics,https://cyberint.uk/,"OSINT, Tools",2025-08-03T03:32:36.560Z,https://rdl.ink/render/https%3A%2F%2Fcyberint.uk%2F,,false
1281117261,OSINT Framework,,,https://osintframework.com/,"OSINT, Tools",2025-08-03T03:32:15.322Z,https://rdl.ink/render/https%3A%2F%2Fosintframework.com%2F,,false
1281114570,IntelTechniques by Michael Bazzell,,,https://inteltechniques.com/,"OSINT, Learning",2025-08-03T03:24:37.006Z,https://inteltechniques.com/img/AD-ALL.png,,false
1281114526,Email Finder: Free email search by name • Hunter,,The leading solution to find professional email addresses. Type someone&#39;s name and a company name to find the email address in seconds.,https://hunter.io/email-finder,"OSINT, Email",2025-08-03T03:24:20.707Z,https://hunter.io/assets/email_finder-Mqv-pC_H.jpg,,false
1281114496,OSINT Dojo,,,https://www.osintdojo.com/,"OSINT, Tools",2025-08-03T03:24:07.507Z,https://rdl.ink/render/https%3A%2F%2Fwww.osintdojo.com%2F,,false
1281114459,GetHuman: Call Companies and Fix Customer Service Issues Faster,,"Phone numbers and customer service contact info for companies and goverment agencies, and free tools that can call or write to customer support for you.",https://gethuman.com/,"Company, Search Engine",2025-08-03T03:23:56.362Z,https://gethuman.com/dist/img/logo-v-500.png,,false
1281114349,Get a whole new identity at the Fake Name Generator,,"The most advanced fake name generator. Generate random names, addresses, usernames, passwords, email addresses, and more. Use for software testing, social media, or anything else.",https://www.fakenamegenerator.com/?__cf_chl_tk=07HycNumUjg.32f6s8cB_M2mqMDW8uPcNBso.kS6bRE-1747021213-1.0.1.1-qRGs7638wU_qraEGve3J2hhderGho86p1HrLWjuzDHk,"Tools, Random, People",2025-08-03T03:23:26.739Z,https://www.fakenamegenerator.com/images/Fake-Name-Generator.jpg,,false
1281114282,Gitstalk,,Discover what your favorite GitHub users are up to,https://gitstalk.netlify.app/,Search Engine,2025-08-03T03:23:01.798Z,https://i.imgur.com/qMnvr0g.png,,false
1281114150,Awesome Osint Alternatives,,:scream: A curated list of amazingly awesome OSINT,https://awesomeopensource.com/project/jivoi/awesome-osint#-pastebins,"OSINT, Tools",2025-08-03T03:22:22.464Z,https://github.com/jivoi.png,,false
