id,title,note,excerpt,url,tags,created,cover,highlights,favorite
1281075588,OffSec’s Exploit Database Archive,,"The Exploit Database - Exploits, Shellcode, 0days, Remote Exploits, Local Exploits, Web Apps, Vulnerability Reports, Security Articles, Tutorials and more.",https://www.exploit-db.com/,"Data Dumps, Cybersecurity, CVE's",2025-08-03T01:47:26.028Z,https://rdl.ink/render/https%3A%2F%2Fwww.exploit-db.com%2F,,false
1281075173,Index of /,,,https://dl.bobpony.com/,Data Dumps,2025-08-03T01:46:49.563Z,https://rdl.ink/render/https%3A%2F%2Fdl.bobpony.com%2F,,false
1281075102,Models - Hugging Face,,We’re on a journey to advance and democratize artificial intelligence through open source and open science.,https://huggingface.co/models,LLM's,2025-08-03T01:46:30.246Z,https://huggingface.co/front/thumbnails/models.png,,false
1281074832,Digital Communications Protocols,,,https://docs.google.com/spreadsheets/d/1-UlA4-tslROBDS9IqHalWVztqZo7uxlCeKPQ-8uoFOU/edit?gid=0#gid=0,"Cybersecurity, Data Dumps, Networking",2025-08-03T01:46:10.907Z,https://lh7-us.googleusercontent.com/docs/AHkbwyJfAi89ldS3QlsGhDo_aLL7pPf4zVe-jvt0o7oXlo_GlB_cd21P7r4boY-3sMJbjK76EvX_I3NAlRQPZZFF1h9EQrfRW0zW-U2QGnHftdUZKzofDBgQ=w1200-h630-p,,false
1281074613,Router Passwords Community Database - The Wireless Router Experts,,We are the largest router passwords community database in the world. Our expert reviews on the best wireless routers and the best wifi routers out there,https://www.routerpasswords.com/,"Data Dumps, Cybersecurity",2025-08-03T01:45:48.813Z,https://rdl.ink/render/https%3A%2F%2Fwww.routerpasswords.com%2F,,false
1281074344,Find And Compare Open Source Projects,,"Find Useful Open Source By Browsing and Combining 169,302 Topics In 59 Categories, Spanning The Top 1,500,000 Projects",https://awesomeopensource.com/,Open Source,2025-08-03T01:45:33.026Z,https://rdl.ink/render/https%3A%2F%2Fawesomeopensource.com%2F,,false
1281074097,MSDN – files.dog,,,https://files.dog/MSDN/,Data Dumps,2025-08-03T01:45:15.818Z,https://files.dog/.doggy/images/img/logo.webp,,false
1281073693,Marginalia Search Engine - Marginalia Search,,"Marginalia Search is a small independent do-it-yourself search engine for surprising but content-rich websites that never ask you to accept cookies or subscribe to newsletters. The goal is to bring you the sort of grass fed, free range HTML your grandma used to write.",https://marginalia-search.com/,Search Engine,2025-08-03T01:44:51.606Z,https://rdl.ink/render/https%3A%2F%2Fmarginalia-search.com%2F,,false
1281073324,Sci-Hub: knowledge belongs to all mankind,,"Sci-Hub website. Get free access to academic journals. Download research papers for free from ScienceDirect, IEEE, Wiley, Springer, Nature and others",https://www.sci-hub.se/,Data Dumps,2025-08-03T01:44:27.152Z,https://www.sci-hub.se/pictures/bulb.png,,false
1281073276,The Eye | Front Page,,The Eye is a website dedicated towards archiving and serving publicly available information. #opendirectory #archive #digitalhistory,https://the-eye.eu/,Data Dumps,2025-08-03T01:44:13.213Z,https://the-eye.eu/static/eye-logo.png,,false
1281073144,Wireshark • WCA (Wireshark Certified Analyst),,Wireshark: The world's most popular network protocol analyzer,https://www.wireshark.org/certifications,"Certifications, Networking",2025-08-03T01:43:38.919Z,https://www.wireshark.org/assets/img/wireshark-logo-big.png,,false
1281073042,Wireshark Certified Analyst (WCA) - The Complete Hands-On Course - packetpioneer.com,,"p data-start=""88"" data-end=""184""strong data-start=""88"" data-end=""132""The Wireshark Certified Analyst (WCA) Complete Course/strongbr data-start=""132"" data-end=""135"" /em data-start=""135"" data-end=""184""Officially Endorsed by the Wireshark Foundation/em/pp data-start=""186"" data-end=""471""This strong data-start=""190"" data-end=""227""Wireshark Certified Analyst (WCA)/strong course is the go-to training for anyone serious about mastering network traffic analysis. Backed by the strong data-start=""332"" data-end=""356""Wireshark Foundation/strong, this hands-on course dives deep into using Wireshark to troubleshoot, analyze, and secure network communications./pp data-start=""473"" data-end=""725""Through strong data-start=""481"" data-end=""545""interactive labs, real-world scenarios, and built-in quizzes/strong, you’ll build the skills to confidently capture and interpret packet data, identify issues, and uncover security concerns—all using the world’s most trusted network analysis tool./pp data-start=""727"" data-end=""743""What you’ll get:/pul data-start=""744"" data-end=""945""li data-start=""744"" data-end=""812""p data-start=""746"" data-end=""812""Step-by-step training from basics to advanced Wireshark features/p/lili data-start=""813"" data-end=""882""p data-start=""815"" data-end=""882""Practice with real traffic captures and troubleshooting scenarios/p/lili data-start=""883"" data-end=""945""p data-start=""885"" data-end=""945""Tools to prep for the strong data-start=""907"" data-end=""943""Wireshark Certified Analyst exam/strong/p/li/ulp data-start=""947"" data-end=""1037""Perfect for network engineers, IT pros, and cybersecurity specialists looking to level up./pp data-start=""947"" data-end=""1037""Ready Packet People? Let's dig./p",https://packetpioneer.com/courses/wca/,"Learning, Networking",2025-08-03T01:43:04.701Z,https://packetpioneer.com/wp-content/uploads/YouTubeWCA.png,,false
1281072930,Servers for Hackers,,What programmers need to know about servers.,https://serversforhackers.com/,"Learning, Servers",2025-08-03T01:42:44.626Z,https://serversforhackers.com/img/sfh-social-lrg.png?b=1,,false
1281072831,Thermodynamics,,,https://users.wpi.edu/~sullivan/ES3001/,"Learning, Thermodynamics",2025-08-03T01:42:12.517Z,https://rdl.ink/render/https%3A%2F%2Fusers.wpi.edu%2F~sullivan%2FES3001%2F,,false
1281072675,Learning about PLCnext Technology,,,https://www.plcnext-community.net/learning/#training,"Learning, Industrial Automation",2025-08-03T01:41:43.086Z,https://www.plcnext-community.net//app/uploads/2024/01/MG_5708-Kopie.jpg,,false
1281072615,Inst Tools | Instrumentation Tutorials | Study Material,,"Instrumentation and Control Engineering Tutorials, Electrical & Electronic Measurement, Industrial Automation, PLC, SCADA, Online Courses.",https://instrumentationtools.com/,"Learning, Industrial Automation",2025-08-03T01:41:25.143Z,https://instrumentationtools.com/wp-content/uploads/2019/06/Instrumentation-Guide.jpg,,false
1281072535,Online Courses,,"Sign up for Fluke online training courses in electrical measurement safety best practices, digital multimeter basics and troubleshooting motors and drives.",https://www.fluke.com/en-us/learn/online-courses,"Learning, Science / Engineering, Electrical",2025-08-03T01:41:00.117Z,https://dam-assets.fluke.com/s3fs-public/styles/0px_12-col/public/training-toc-solar-1500x1000.jpg,,false
1281072405,Basic Electronics Tutorials and Revision,,"Basic Electronics Tutorials and Revision Helps Beginners and Beyond Learn Basic Electronic Circuits, Engineering, and More. Visit Today!",https://www.electronics-tutorials.ws/,"Learning, Science / Engineering, Electrical",2025-08-03T01:40:49.056Z,https://www.electronics-tutorials.ws/wp-content/uploads/2024/12/ntc-thermistor.jpg?fit=320%2C320,,false
1281072348,Fowler's Physics Applets,,,https://galileo.phys.virginia.edu/classes/109N/more_stuff/Applets/home.html,"Learning, Science / Engineering, Physics",2025-08-03T01:40:31.814Z,https://galileo.phys.virginia.edu/classes/109N/more_stuff/Applets/clips/lunar_eclipse.png,,false
1281072204,Complex Analysis,,An online interactive introduction to the study of complex analysis.,https://complex-analysis.com/,"Learning, Science / Engineering",2025-08-03T01:39:42.518Z,https://complex-analysis.com/images/complex_analysis_card.jpg,,false
1281072151,Home - Antisyphon Training,,"Home of Pay What You Can training, Antisyphon provides high-quality and cutting-edge education to everyone, regardless of their financial position.",https://www.antisyphontraining.com/,"Learning, Cybersecurity",2025-08-03T01:39:24.028Z,https://www.antisyphontraining.com/wp-content/uploads/2024/05/Header_Logo_BW_Resized.png,,false
1281070487,Doublespeak.chat,,A text-based AI escape game by Forces Unseen.,https://doublespeak.chat/#/handbook,"Learning, Cybersecurity, LLM's",2025-08-03T01:38:45.251Z,https://doublespeak.chat/social_preview.png,,false
1281068395,Web Security Academy: Free Online Training from PortSwigger,,"The Web Security Academy is a free online training center for web application security, brought to you by PortSwigger. Create an account to get started.",https://portswigger.net/web-security,"Learning, Cybersecurity",2025-08-03T01:38:32.185Z,https://portswigger.net/content/images/logos/academy-twittercard.png,,false
1281066893,Free Math Lessons,,"Learn math at your own pace for FREE with ChiliMath.com! Perfect resource for students, parents, and teachers to build confidence in algebra/math. Free math lessons for everyone!",https://www.chilimath.com/,"Learning, Mathmatics",2025-08-03T01:38:17.401Z,https://www.chilimath.com/wp-content/uploads/2024/07/introductory-algebra.svg,,false
1281065950,Learn backend development the smart way | Boot.dev,,"Welcome to the most captivating, finger-flying, addictive way to learn to code. The smartest way to learn a thing is to ensure you're never bored.",https://www.boot.dev/,"Programming, Learning",2025-08-03T01:38:07.311Z,https://www.boot.dev/_nuxt/bootsballanfull.B8qIFEHI.webp,,false
1281064498,Your Career in Web Development Starts Here | The Odin Project,,The Odin Project empowers aspiring web developers to learn together for free,https://www.theodinproject.com/,"Learning, Programming, Web",2025-08-03T01:37:11.258Z,https://www.theodinproject.com/assets/og-logo-2bdf3a30.png,,false
1281063144,Dr. Charles R. Severance Home Page,,,https://dr-chuck.com/,"Programming, Learning",2025-08-03T01:36:19.264Z,https://dr-chuck.com/Chuck_Square_B&W.jpg,,false
1281062950,dave eddy,,,https://www.daveeddy.com/,"Learning, Programming",2025-08-03T01:36:07.898Z,https://secure.gravatar.com/avatar/6c7581ac69deeb96d3e9d0ee1e941af3?s=200,,false
1281062794,TCM Security Academy,,"TCM Security Academy offers practical, job-focused cybersecurity training designed by industry-leading instructors that doesn't break the bank.",https://academy.tcm-sec.com/,"Learning, Cybersecurity",2025-08-03T01:35:52.471Z,https://file-uploads.teachablecdn.com/c8250cc07e4e48f39cfe04767c5e3af1/09147a6d0c824fdaa5acc7dbee13bd5c,,false
1281062345,Tutorial #1: Control Challenges,,,https://janismac.github.io/ControlChallenges/,"Learning, Programming",2025-08-03T01:35:29.588Z,https://rdl.ink/render/https%3A%2F%2Fjanismac.github.io%2FControlChallenges%2F,,false
1281062119,Coding for Kids - Learn Python By Playing,,"Learn Python online interactively by playing a game, right from your browser. Ideal for children aged 7-15. Start coding today!",https://codingforkids.io/en/,"Learning, Programming, Child",2025-08-03T01:35:12.486Z,https://codingforkids.io/assets/promo/promo_hor_scale_complete.png,,false
1281061841,Explore courses - Coddy,,"Coddy is providing Handwritten, Focused and practice driven courses. Start coding now and achieve great knowledge in the coding industry!",https://coddy.tech/courses,"Learning, Programming",2025-08-03T01:34:52.479Z,https://storage.googleapis.com/coddy-15505.appspot.com/public/coddy-logo-trans.png,,false
1281061634,CodeChef | CodeChef: Practical coding for everyone,,CodeChef | CodeChef: Practical coding for everyone,https://www.codechef.com/,"Programming, Learning",2025-08-03T01:34:42.393Z,https://cdn.codechef.com/sites/all/themes/abessive/cc-logo.png,,false
1281061421,Free for Developers,,"Developers and Open Source authors now have a massive amount of services offering free tiers, but it can be hard to find them all to make informed decisions.",https://free-for.dev/#/,"Learning, Programming",2025-08-03T01:34:30.965Z,https://raw.githubusercontent.com/ripienaar/free-for-dev/master/logo.webp,,false
1281061126,learnbyexample,,"Learn Python, Regex, Linux, Scripting, Vim, Ebooks, Self-Publishing and Interesting Tech Nuggets.",https://learnbyexample.github.io/,"Learning, Programming",2025-08-03T01:34:16.228Z,https://learnbyexample.github.io/images/learnbyexample.png,,false
1281060938,Learn Python - Free Interactive Python Tutorial,,"learnpython.org is a free interactive Python tutorial for people who want to learn Python, fast.",https://www.learnpython.org/,"Learning, Programming",2025-08-03T01:34:03.795Z,https://www.learnpython.org/static/img/share-logos/learnpython.org.png,,false
1281060806,"Computer, Enhance! | Casey Muratori | Substack",,"Programming courses, interviews, commentary. Click to read ""Computer, Enhance!"", by Casey Muratori, a Substack publication with tens of thousands of subscribers.",https://www.computerenhance.com/,"Learning, Computers, Programming",2025-08-03T01:33:51.633Z,"https://substackcdn.com/image/fetch/$s_!pxWL!,f_auto,q_auto:best,fl_progressive:steep/https%3A%2F%2Fcomputerenhance.substack.com%2Ftwitter%2Fsubscribe-card.jpg%3Fv%3D-648255046%26version%3D9",,false
1281059400,W3Schools.com,,"W3Schools offers free online tutorials, references and exercises in all the major languages of the web. Covering popular subjects like HTML, CSS, JavaScript, Python, SQL, Java, and many, many more.",https://www.w3schools.com/,"Learning, Programming",2025-08-03T01:32:50.758Z,https://www.w3schools.com/images/w3schools_logo_436_2.png,,false
1281058983,"Online Courses - Learn Anything, On Your Schedule | Udemy",,"Udemy is an online learning and teaching marketplace with over 250,000 courses and 80 million students. Learn programming, marketing, data science and more.",https://www.udemy.com/,"Learning, Courses",2025-08-03T01:32:38.191Z,https://s.udemycdn.com/meta/default-meta-image-v2.png,,false
1281058475,Teach Yourself Computer Science,,All the resources you need to give yourself a world class computer science education,https://teachyourselfcs.com/,"Learning, Programming",2025-08-03T01:32:19.989Z,https://teachyourselfcs.com/bilotta-tweet.png,,false
1281058191,Open Learning,,,https://www.open.edu/openlearn/free-courses/full-cataloguek,"Learning, Courses",2025-08-03T01:32:03.488Z,https://www.open.edu/openlearn/theme/image.php/openlearnng/theme_openlearnng/1750838146/logo,,false
1281057668,Exercism,,"Learn, practice and get world-class mentoring in over 50 languages. 100% free.",https://exercism.org/,"Learning, Programming",2025-08-03T01:31:45.025Z,https://assets.exercism.org/meta/og.png,,false
1281057401,"edX | Online Courses, Certificates &amp; Degrees from Leading Institutions",,"Find the online learning path for you, delivered by world-class institutions like Harvard, Google, Amazon, and more.",https://www.edx.org/,"Learning, Courses",2025-08-03T01:31:30.722Z,https://rdl.ink/render/https%3A%2F%2Fwww.edx.org%2F,,false
1281056857,"Class Central • Find the best courses, wherever they exist.",,"Class Central aggregates courses from many providers to help you find the best courses on almost any subject, wherever they exist.",https://www.classcentral.com/,"Learning, Courses",2025-08-03T01:30:51.186Z,https://ccweb.imgix.net/https%3A%2F%2Fwww.classcentral.com%2Fimages%2Fmeta%2Fmeta-default.png?auto=format&ixlib=php-4.1.0&s=a980b3b7b5c83a15eac6da49bbbbc182,,false
1281056107,Alison | Free Online Courses & Online Learning,,"Free online courses with certificates. Join 10 million graduates and empower your career. Study, learn, certify, upskill with free online learning and training",https://alison.com/,"Learning, Courses",2025-08-03T01:30:40.348Z,https://cdn01.alison-static.net/public/html/site/img/sharing/alison-share__1742480996000.png,,false
1281055944,Learn Anything,,"Discover and learn about any topic with Learn-Anything. Our free, comprehensive platform connects you to the best resources for every subject. Start learning today!",https://learn-anything.xyz/,"Learning, Programming",2025-08-03T01:30:23.577Z,https://rdl.ink/render/https%3A%2F%2Flearn-anything.xyz%2F,,false
1281054593,Home - The XY Problem,,,https://xyproblem.info/,Learning,2025-08-03T01:29:36.767Z,https://rdl.ink/render/https%3A%2F%2Fxyproblem.info%2F,,false
1281053993,Algebra practice problems,,✅,https://www.algebrapracticeproblems.com/,"Learning, Mathmatics",2025-08-03T01:29:19.821Z,https://rdl.ink/render/https%3A%2F%2Fwww.algebrapracticeproblems.com%2F,,false
1281053579,Overview and List of Topics | mathhints.com,,"MathHints.com (formerly mathhints.com) is a free website that includes hundreds of pages of math, explained in simple terms, with thousands of examples of worked-out problems. Topics cover basic counting through Differential and Integral Calculus!",https://mathhints.com/,"Learning, Mathmatics",2025-08-03T01:29:06.532Z,https://rdl.ink/render/https%3A%2F%2Fmathhints.com%2F,,false
1281053320,Math3ma,,"Math3ma is a blog about mathematics, maintained by Tai-Danae Bradley.",https://www.math3ma.com/,"Learning, Mathmatics",2025-08-03T01:28:54.698Z,https://cdn.prod.website-files.com/5b1d421032996833ff2a7704/5b7dbcabd91445500fb0c957_newM.jpg,,false
1281052671,Free Math Worksheets for Kids from the Math Salamanders,,"Our Math Salamanders website is packed full of free math worksheets as well as math games, math puzzles and interactive math activities.",https://www.math-salamanders.com/,"Learning, Mathmatics, Child",2025-08-03T01:28:38.963Z,https://www.math-salamanders.com/image-files/captain-salamander-clues.png,,false
1281051336,Home | Linux Journey,,,https://linuxjourney.com/,"Learning, Linux",2025-08-03T01:28:04.334Z,https://linuxjourney.com/assets/jumbotron-60c93c2fc6bb16079b70fe2eccacaa05f2d6b002af4ff0667ddd8e283cbf81fd.png,,false
1281050788,CML Free,,"Life is good when you can lab from anywhere. Cisco Modeling Labs Free makes it fun to design, test, troubleshoot, and learn with the Cisco premier platform for network simulations. It's the perfect tool for network engineers, architects, and students to gain real-world, hands-on practice as they learn-and prep for certification exams without any initial cost.

Sign up today to start labbing now.",https://mkto.cisco.com/cml-free.html,"Learning, Networking",2025-08-03T01:27:44.620Z,https://mkto.cisco.com/rs/564-WHV-323/images/CMLPowerUser_CML_400X327.jpg?version=0,,false
1281050589,Cisco U. | Cisco U,,,https://u.cisco.com/,"Learning, Networking",2025-08-03T01:27:35.026Z,https://u.cisco.com/static/assets/unauth-landing-heading-B7Q71623.png,,false
1281050213,Cisco Learning Network,,"Get valuable IT training resources for all Cisco certifications. Access IT certification study tools, CCNA practice tests, Webinars and Training videos.",https://learningnetwork.cisco.com/s/,"Learning, Networking",2025-08-03T01:27:12.986Z,https://learningcontent.cisco.com/images/Explore_Catalog_laptop_tile.png,,false
1281049695,Basic Elements of AWS,,AWS provides all the necessary building blocks for the modern web. Learn how to get started and build more powerful applications.,https://www.proaws.dev/tutorials/basic-elements-of-aws~hk2qv,"Learning, Cloud Engineering",2025-08-03T01:26:54.544Z,"https://res.cloudinary.com/badass-courses/image/upload/c_limit,w_640/f_auto/q_auto/v1714106928/tutorials/tutorial-iai9a/d4lscw4tnubandjze7lc?_a=BAVCkKAP0",,false
1281048948,Data Structures Cheat Sheet,,,https://www.clear.rice.edu/comp160/data_cheat.html,"Data Structures, Cheatsheet",2025-08-03T01:26:29.866Z,https://rdl.ink/render/https%3A%2F%2Fwww.clear.rice.edu%2Fcomp160%2Fdata_cheat.html,,false
1281048038,Big O cheat sheets,,,https://cooervo.github.io/Algorithms-DataStructures-BigONotation/,"Programming, Learning, Algorithms, Data Structures",2025-08-03T01:26:04.409Z,https://rdl.ink/render/https%3A%2F%2Fcooervo.github.io%2FAlgorithms-DataStructures-BigONotation%2F,,false
1281047441,Algorithm Visualizer,,Algorithm Visualizer is an interactive online platform that visualizes algorithms from code.,https://algorithm-visualizer.org/,"Programming, Learning, Algorithms",2025-08-03T01:25:45.979Z,https://raw.githubusercontent.com/algorithm-visualizer/algorithm-visualizer/master/branding/screenshot.png,,false
1281046322,The Missing Semester of Your CS Education,,,https://missing.csail.mit.edu/,"Learning, Programming",2025-08-03T01:25:11.574Z,https://rdl.ink/render/https%3A%2F%2Fmissing.csail.mit.edu%2F,,false
1281046039,visualising data structures and algorithms through animation - VisuAlgo,,"VisuAlgo was conceptualised in 2011 by Associate Professor Steven Halim (NUS School of Computing) as a tool to help his students better understand data structures and algorithms, by allowing them to learn the basics on their own and at their own pace. Together with his students from the National University of Singapore, a series of visualizations were developed and consolidated, from simple sorting algorithms to complex graph data structures. Though specifically designed for the use of NUS students taking various data structure and algorithm classes (CS1010/equivalent, CS2040/equivalent (inclusive of IT5003)), CS3230, CS3233, and CS4234), as advocators of online learning, we hope that curious minds around the world will find these visualizations useful as well.",https://visualgo.net/en,"Programming, Learning, Algorithms, Data Structures",2025-08-03T01:24:55.894Z,https://visualgo.net/img/png.png,,false
1281044486,Advent of Code 2024,,,https://adventofcode.com/2024,"Programming, Challenge",2025-08-03T01:24:16.235Z,https://rdl.ink/render/https%3A%2F%2Fadventofcode.com%2F2024,,false
1281044072,"Putting the ""You"" in CPU",,"Curious exactly what happens when you run a program on your computer? Learn how multiprocessing works, what system calls really are, how computers manage memory with hardware interrupts, and how Linux loads executables.",https://cpu.land/,"Learning, Computers",2025-08-03T01:24:02.207Z,https://cpu.land/banner.png,,false
1281043695,Guide to x86 Assembly,,,https://www.cs.virginia.edu/~evans/cs216/guides/x86.html,"Programming, Learning, Assembly",2025-08-03T01:23:44.558Z,https://www.cs.virginia.edu/~evans/cs216/guides/x86-registers.png,,false
1281042383,Knowledge Evolved | Noba,,"Noba is an open and free online platform that provides high-quality, flexibly structured textbooks and educational materials.",https://nobaproject.com/,"Learning, Psychology",2025-08-03T01:22:55.960Z,https://nobaproject.com/assets/logo@2x-29e962061463ae198c2979b247665c2b5f0f6e6a4d4195b8cf78ba537b45c3f4.png,,false
1281041738,"Home - Professor Messer IT Certification Training - CompTIA A+, Network+, Security+",,Watch the A+ 220-1101 Core 1 VideosGet the 220-1101 Course NotesGet the 220-1101 Practice ExamsDownload the A+ 220-1101 videosWatch the A+ 220-1101 Study,https://www.professormesser.com/,"Learning, CompTia",2025-08-03T01:22:33.998Z,https://www.professormesser.com/wp-content/uploads/2021/08/home-splash-850-v4.jpg,,false
1281039785,MIT OpenCourseWare | Free Online Course Materials,,MIT OpenCourseWare is a web based publication of virtually all MIT course content. OCW is open and available to the world and is a permanent MIT activity,https://ocw.mit.edu/,"Learning, Courses",2025-08-03T01:21:16.380Z,https://ocw.mit.edu/static_shared/images/ocw_logo_white_on_black.dc6662ab918cec1c2f31.png,,false
1281038907,LitSolutions,,Free Step By Step Problem Solutions For University Textbooks. LitSolutions,https://www.litsolutions.org/,Textbooks,2025-08-03T01:20:53.731Z,"https://static.wixstatic.com/media/73dff9_885d4455196f45b9970ddc95f4b2da6f~mv2.png/v1/fill/w_1091,h_539,al_c/73dff9_885d4455196f45b9970ddc95f4b2da6f~mv2.png",,false
1281037101,P. Sam Johnson's Personal Webpage,,,https://sam.nitk.ac.in/courses-taught.html,"Learning, Mathmatics",2025-08-03T01:19:51.505Z,https://rdl.ink/render/https%3A%2F%2Fsam.nitk.ac.in%2Fcourses-taught.html,,false
1281036768,Free Printable Worksheets for Kids,,"Kiddo Worksheets has a lot of free educational resources. Get free printable worksheets for Preschool, Kindergarten & Grades from 1 to 5 curriculum.",https://www.kiddoworksheets.com/,"Learning, Child",2025-08-03T01:18:28.942Z,https://www.kiddoworksheets.com/wp-content/uploads/2021/07/Facebook-CoverPhoto.jpg,,false
1281036610,Know it all,,"A big list of all the props, values, methods, functions, interfaces, modules, constants, constructors, events, attributes, parameters, return values, variables, elements, statements, operators, declarations, types, primatives, selectors and units of all the APIs related to web development.",https://know-it-all.io/,"Learning, Programming",2025-08-03T01:18:08.585Z,https://rdl.ink/render/https%3A%2F%2Fknow-it-all.io%2F,,false
1281036464,The Ultimate List of SANS Cheat Sheets,,Need help cutting through the noise? SANS has a massive list of Cheat Sheets available for quick reference.,https://www.sans.org/blog/the-ultimate-list-of-sans-cheat-sheets,Cheatsheet,2025-08-03T01:17:31.609Z,https://images.contentstack.io/v3/assets/blt36c2e63521272fdc/blt8963e4b73ad2b120/5eb07a7f2b79652f27c32d46/CheatSheets_Blog_banner.png,,false
1281036134,Key Differences,,Know the Differences & Comparisons,https://keydifferences.com/,Learning,2025-08-03T01:17:03.675Z,https://rdl.ink/render/https%3A%2F%2Fkeydifferences.com%2F,,false
1281035449,KeepSimple,,"Unique educational tools for managers, built to enhance decision-making quality and drive better leadership outcomes.",https://keepsimple.io/,Learning,2025-08-03T01:16:41.333Z,https://strapi.keepsimple.io/uploads/Articles_2_5dddcb4c96.png,,false
