id,title,note,excerpt,url,tags,created,cover,highlights,favorite
1281203215,"ToolBaz : Free AI Writer Tools (GPT-4o, Gemini & More)",,"Explore ToolBaz's free AI writing tools powered by GPT-4, Gemini, Meta-AI, and more. Enhance content creation, essays, stories, and emails with cutting-edge AI.",https://toolbaz.com/,"Tools, Writing",2025-08-03T04:27:37.507Z,https://toolbaz.com/assets/og-image/1.php?title=Free+AI+Writer+Tools&button=Try%20Now&desc=Explore+ToolBaz%27s+free+AI+writing+tools+powered+by+GPT-4%2C+Gemini%2C+Meta-AI%2C+and+more.+Enhance+content+creation%2C+essays%2C+stories%2C+and+emails+with+cutting-edge+AI.,,false
1281201917,APA Citation Generator,,"How to create APA citations APA Style is widely used by students, researchers, and professionals in the social and behavioral sciences. Scribbr's free",https://www.scribbr.com/citation/generator/apa/,"Writing, Tools",2025-08-03T04:27:22.313Z,https://www.scribbr.com/wp-content/uploads/2021/02/open-graph-apa-citation-generator.png,,false
1281200330,Dark Reading Resource Library,,Explore the latest multimedia resources brought to you by the editors of Dark Reading,https://www.darkreading.com/resources?types=Whitepaper,"Cybersecurity, Data Dumps, Articles",2025-08-03T04:27:07.028Z,https://www.darkreading.com/assets/darkreading.ico,,false
1281199374,"Automation Community - Courses, Tutorials, Products",,"Automation community provides free tutorials and courses on PLC, SCADA, Instrumentation, electrical, and industrial products.",https://automationcommunity.com/,"Industrial Automation, Learning, Social Networking",2025-08-03T04:26:52.978Z,https://automationcommunity.com/wp-content/uploads/2023/01/automationcommunity.jpg,,false
1281198074,Login,,Connect with ShawnTierney and other members of Automation community,https://automation.locals.com/login,"Industrial Automation, Social Networking",2025-08-03T04:26:37.282Z,https://media3.locals.com/images/groups/originals/2023-11-18/389898/389898_nxypjrlk4ixo1vf.jpeg,,false
1281195553,Introducing the Framework Desktop and newest Framework Laptop 13,,Choose between our latest Framework Laptop 13 powered by Ryzen™ AI 300 Series processors or our brand new Framework Desktop with Ryzen™ AI Max Series processors.,https://frame.work/,"Computers, Buying",2025-08-03T04:26:11.835Z,"https://images.prismic.io/frameworkmarketplace/Z9NRJRsAHJWomhN9_FWFamily-12-13-16-Desktop.jpg?auto=format,compress",,false
1281193964,Flipper Zero BFFB,,A do-it-all peripheral for the Flipper Zero. Wardrive with Marauder or perform all of your various subghz and mouse jacking operations.,https://justcallmekokollc.com/products/flipper-zero-bffb,"Flipper, Buying",2025-08-03T04:25:56.687Z,http://justcallmekokollc.com/cdn/shop/files/DSC01132-Edit-2.jpg?v=1744057107,,false
1281192319,Play and manage Game Boy cartridges on your PC | GB Operator,,Like adding a cartridge slot to your PC. Tightly integrated emulator that updates the save file as you play. Save management and much more.,https://www.epilogue.co/product/gb-operator,"Gaming, Tools, Gameboy",2025-08-03T04:25:43.421Z,https://www.epilogue.co/assets/media/products/index.jpg,,false
1281190190,Engine DIY Kit | Engine Model Building Kits for Adults - EngineDIY,,"EngineDIY: your top destination for model engines & accessories for engine enthusiasts. Shop V8 engine, steam, stirling, antique, internal combustion & STEM models today!",https://www.enginediy.com/?sub_id=MA,"Science / Engineering, Building, Buying",2025-08-03T04:25:22.721Z,https://www.enginediy.com/cdn/shop/files/25-7-17-_-ED-1920x512-2_1920x512.jpg?v=1754033668,,false
1281188637,GoTAK - Plug & Play Situational Awareness,,"GoTAK - Plug & Play ATAK - EUDs, Servers, Comms and RF solutions for law enforcement, military, government, public safety and civilians.",https://getgotak.com/,"Buying, Privacy, Tools",2025-08-03T04:25:07.155Z,http://getgotak.com/cdn/shop/files/1000002815.jpg?v=1725245636,,false
1281186666,Sendak Waxed Canvas Artist Roll – Peg and Awl,,"Our Waxed Canvas Artist Roll with 23 pockets is the perfect artist gift for carrying pens, pencils, brushes, paint kits, notebooks and more with ease. Ultimate Pencil Case for urban sketchers, plein air, and travelers. Closes with leather strap.",https://pegandawlbuilt.com/collections/bags-1/products/waxed-canvas-sendak-artist-roll?variant=42608960438463,"Buying, Art",2025-08-03T04:24:44.524Z,https://pegandawlbuilt.com/cdn/shop/files/Classic-Sendak-Artist-Roll_peg-andawl-2_960x960.jpg?v=1746817536,,false
1281183237,SLNT® Faraday Bags,,"At SLNT, we create Faraday bags & RFID wallets trusted by Google, and US Army that effortlessly fit into your daily routine for continuous data protection.",https://slnt.com/,"Buying, Clothing",2025-08-03T04:24:11.365Z,https://slnt.com/cdn/shop/files/SLNT-width-800-height-600.jpg?v=1643059621,,false
1281182199,"5.11 Tactical®: Premium Tactical Gear, Clothing & Accessories",,"Shop high-quality tactical gear, clothing, bags, footwear, and accessories at 5.11 Tactical®. Designed for professionals, outdoor enthusiasts, and more.",https://www.511tactical.com/,"Clothing, Buying",2025-08-03T04:23:59.507Z,https://www.511tactical.com/media/gene-cms/homepage/2507/2507_EC_25OffBottoms_HPBanner_desk.jpg,,false
1281178347,Cargo Containers - 1x1 (Mini Modular Storage) - 3D model by Play Conveyor on Thangs,,"**Cargo Containers - 1x1 (Mini Modular Storage)**

You’ll never need more storage again with the Cargo Containers - the infinitely modular storage containers th",https://thangs.com/designer/Play%20Conveyor/3d-model/Cargo%20Container%20Mini%27s%20-%20Cargo%20Connect%20Compatible-1191155,3D Printing,2025-08-03T04:23:27.989Z,https://thangs.com/_next/image?url=https%3A%2F%2Fstorage.googleapis.com%2Fproduction-thangs-public%2Fuploads%2Fattachments%2Fb1f28696-099a-49a1-8d6c-20b14d6eb2a2%2FCargo%2520Containers%2520Mini.jpeg&w=640&q=85,,false
1281176624,"Amazon US price tracker, price history, price watch, price drop alerts, and price notifications.",,"Page 1 at camelcamelcamel: Amazon US price tracker, price history, price watch, price drop alerts, and price notifications.",https://camelcamelcamel.com/,"Buying, Deals",2025-08-03T04:23:14.982Z,https://assets.camelcamelcamel.com/live-assets/camelcamelcamel-logo-2018-583259dd2c1880ff44d801e313ca1d885d2ea345690072a457c5af98b5ca513f.png,,false
1281170063,Government Surplus Auctions,,"GovDeals' online marketplace provides services to government, educational, and related entities for the sale of surplus assets to the public. Auction rules may vary across sellers.",https://www.govdeals.com/,"Buying, Auctions",2025-08-03T04:22:28.915Z,https://webassets.lqdt1.com/ecomm/govdeals/gd_Homepage_Grid-03.png?w=1024&webp=true,,false
1281167257,Search,,"GovDeals' online marketplace provides services to government, educational, and related entities for the sale of surplus assets to the public. Auction rules may vary across sellers.",https://www.govdeals.com/en/search/filters?zipcode=52333&miles=25&showMap=0&source=location-search,"Buying, Auctions",2025-08-03T04:22:09.657Z,https://www.govdeals.com/assets/images/heros/govdeals-logo-1200x630-margin.png,,false
1281162873,John Deere Parts Catalog,,"Find parts & diagrams for your John Deere equipment. Search our parts catalog, order parts online or contact your John Deere dealer.",https://partscatalog.deere.com/jdrc/navigation/equipment/22735,"Lawn Mower, Home, Yard",2025-08-03T04:21:42.165Z,https://partscatalog.deere.com/jdrc-services/v1/image/getImageBlob?locale=en-US&type=D&iid=531288,,false
1281161442,Home Power Buyer,,"Shop directly from wholesale liquidators on B-Stock. Bid on liquidator pallets from top retailers including Amazon, Walmart, Target, and more.",https://bstock.com/,"Home, Appliances, Auctions",2025-08-03T04:21:26.280Z,https://bstock.com/home-portal/images/bstock_logo.png,,false
1281158731,"FreePBX | Open source, web-based, IP PBX management tool.",,"Freedom to Communicate The ""Free"" in FreePBX stands for Freedom. That's because FreePBX, the world's most popular open source IP PBX, gives users the",https://www.freepbx.org/,"Home, Servers, Phone",2025-08-03T04:21:08.594Z,https://www.freepbx.org/wp-content/uploads/Sangoma_FreePBX_Logo_RGB_vert-pos-e1588862438350.png,,false
1281157340,ECO 250 - Ecolawn Applicator,,,https://www.ecolawnapplicator.com/products/eco-250/,"Home, Yard, Tools",2025-08-03T04:20:50.741Z,https://www.ecolawnapplicator.com/wp-content/uploads/2018/04/ECO-250-600x464.jpg,,false
1281155582,The Kirby Company,,"The Kirby Company is renowned for our powerful upright vacuum, carpet shampooer, hard floor cleaner, and so much more! Click to learn more today!",https://www.kirby.com/,"Home, Tools",2025-08-03T04:20:38.883Z,https://www.kirby.com/wp-content/uploads/2020/07/Made-in-America_2018.png,,false
1281154185,Tankless Water Heater Endless Hot Water,,Noritz is the premiere tankless water heater manufacturer for gas tankless water heaters and propane tankless water heaters. Residential or commercial tankless water heaters,https://noritz.com/,"Home, Appliances",2025-08-03T04:20:31.411Z,https://noritz.com/img/asset/YXNzZXRzLzI0LW5vcml0el9zMDEtcmVzaWRlbnRpYWwtZ2FyYWdlX21pZC1hLmpwZw==?fm=webp&q=100&s=227478d6a3c9aa5364aef108d6063051,,false
1281153209,Perlick Corporation - Commercial Refrigerator and Bar Equipment Supplier - Perlick Corporation,,Perlick Corporation is a premier commercial and residential refrigeration supplier. We offer a full line of refrigeration and bar beverage dispensing equipment.,https://www.perlick.com/,"Home, Kitchen, Cooking",2025-08-03T04:20:22.619Z,https://cdn.prod.website-files.com/65b96d44a15b3d7627ae6487/67ac48766d6b956126fc4eee_Corporate%20LP_Commercial%20-p-1080.jpg,,false
1281148252,Resources for Building Your Deck | How-To's & Deck Plans | Decks.com,,"Decks.com has everything you need for your new deck, such as downloadable deck plans and step-by-step guides. Get started on your project at Decks.com.",https://www.decks.com/,"Building, Wood, Home",2025-08-03T04:19:40.821Z,https://www.decks.com/media/g4hpiomv/logo_decks_dark-blue.svg?width=1000&height=230&v=1dc009625255410&quality=80,,false
1281146681,HVAC Mini Split Systems | Pioneer Mini Split,,"We are a trusted mini split manufacturer of wholesale HVAC mini split systems. Our options include multi-zone, ductless, concealed, ducted, and many more.",https://www.pioneerminisplit.com/,"HVAC, Home",2025-08-03T04:19:30.709Z,http://www.pioneerminisplit.com/cdn/shop/files/PMS_Store_abe073af-e894-4f8e-9df9-1437c4064160.jpg?v=1744672740,,false
1281145122,AJ Madison,,,https://www.ajmadison.com/,"Appliances, Home",2025-08-03T04:19:18.273Z,https://cdn.sanity.io/images/zxa9sx3l/production/23b5cb6c98777b514b2682d4a47b237312275a9f-15360x5309.jpg?w=1080&q=75&fit=crop&auto=format,,false
1281143340,SPAN® | Smart Electrical Panels,,Lower your energy bill with SPAN smart electrical panels - advanced features and intelligent design save you money and energy.,https://www.span.io/,"Tools, Home",2025-08-03T04:19:04.631Z,https://cdn.prod.website-files.com/628f26de26f0252b4094378b/64ac3b239f07ac92bdcd9ccf__og_home_span.jpeg,,false
1281141759,Perfect Products – DoorSaver | BlueThing | Ultimate Gate Latch,,,https://doorsaver.com/,"Tools, Home",2025-08-03T04:18:53.897Z,https://doorsaver.com/wp-content/uploads/elementor/thumbs/door_saver_3_01234_ppstockphoto_jpg-r2rmciwyl4eos78ksa2qnxq1328hdw036opeqikcik.jpg,,false
1281137676,Directory listing of http://files.alfa.com.tw/[1] WiFi USB adapter/AWUS036AXML,,,https://files.alfa.com.tw/?dir=%5B1%5D%20WiFi%20USB%20adapter/AWUS036AXML,"Drivers, ALFA, Networking, Tools",2025-08-03T04:18:27.848Z,https://rdl.ink/render/https%3A%2F%2Ffiles.alfa.com.tw%2F%3Fdir%3D%255B1%255D%2520WiFi%2520USB%2520adapter%2FAWUS036AXML,,false
1281134306,IOTA | Traffic Capture & Analysis Solution | Profitap,,"IOTA is a powerful network capture and analysis solution for edge and core networks. The IOTA lineup consists of portable EDGE models, high-speed CORE models, and the IOTA CM centralized device management system.",https://www.profitap.com/iota/,"Networking, Tools, Cybersecurity",2025-08-03T04:18:09.597Z,https://www.profitap.com/wp-content/uploads/IOTA-Medal.png,,false
1281132300,NetBird Login,,,https://login.netbird.io/login?state=hKFo2SB2SW9HZVg2ckRtSlgxci1xbVlwbHc5c2Y4Y2RKcVZ3RKFupWxvZ2luo3RpZNkgaVNweUpLTk1CQUltejJhMzk4bE1zWEw0c1Z5TjUwNWijY2lk2SBBYzNZUXMxc05PcUs1SHJZOVYxMjN4Z2VKSk96VmhnYw&client=Ac3YQs1sNOqK5HrY9V123xgeJJOzVhgc&protocol=oauth2&redirect_uri=https%3A%2F%2Fapp.netbird.io%2F%23callback&scope=openid%20profile%20email%20api%20offline_access%20email_verified&response_type=code&audience=https%3A%2F%2Fapp.wiretrustee.com%2F&nonce=Dza1PypSchXg&code_challenge=4AX94IFz8RPgBgGml0HUizSXd0lODBFaultvywYmzjU&code_challenge_method=S256,"Servers, Home",2025-08-03T04:17:56.245Z,,,false
1281131913,Wazuh - Open Source XDR. Open Source SIEM.,,Wazuh is a free and open source security platform that unifies XDR and SIEM protection for endpoints and cloud workloads.,https://wazuh.com/,"Servers, Cybersecurity, Home",2025-08-03T04:17:38.200Z,https://wazuh.com/uploads/2024/01/wazuh-cover.png,,false
1281131802,Artillery · The Complete Load Testing Platform,,"Keep production reliable, customers happy, and pagers silent.",https://www.artillery.io/,"Servers, Home",2025-08-03T04:17:17.273Z,https://www.artillery.io/api/og?title=The%20Complete%20Load%20Testing%20Platform&description=Artillery%20is%20an%20open%20source%20load%20testing%20platform.%20It%20contains%20everything%20you%20need%20to%20go%20from%20zero%20to%20production-grade%20load%20testing%20fast.,,false
1281131745,Dashy | Dashy,,"Documentation | Dashy, a self-hosted dashboard for your homelab",https://dashy.to/docs/,"Home, Servers",2025-08-03T04:17:02.521Z,https://rdl.ink/render/https%3A%2F%2Fdashy.to%2Fdocs%2F,,false
1281131712,Octopart: Electronics Parts Search Engine,,"Millions of engineers, scientists, and sourcing professionals use Octopart tools to quickly access a comprehensive, up-to-date library of electronic part data, supporting their work from the beginning of a design through fabrication.",https://octopart.com/,"Electrical, Parts",2025-08-03T04:16:55.448Z,https://n1.octostatic.com/nextopart/static/octopart-powered-by-nexar.png,,false
1281131651,iFixit: The Free Repair Manual,,"iFixit is a global community of people helping each other repair things. Let's fix the world, one device at a time. Troubleshoot with experts in the Answers forum—and build your own how-to guides to share with the world. Fix your Apple and Android devices—and buy all the parts and tools needed for your DIY repair projects.",https://www.ifixit.com/,"Manual, Tools",2025-08-03T04:16:43.434Z,https://guide-images.cdn.ifixit.com/igi/YlogWMLVAtHbPF5J.full,,false
1281131600,Freecycle: Front Door,,,https://www.freecycle.org/,Buying,2025-08-03T04:16:29.493Z,https://rdl.ink/render/https%3A%2F%2Fwww.freecycle.org%2F,,false
1281131528,Netmaker: Zero Trust Platform for Secure Networking,,"Securely connect your devices, clouds, and sites with Netmaker's Zero Trust platform. Fast WireGuard tunnels combined with granular access controls for true ZTNA.",https://www.netmaker.io/,"Servers, Home",2025-08-03T04:16:09.019Z,https://cdn.prod.website-files.com/64149f8bba6c1301c5e75001/67bf20d0f8eceddc0012d168_demoapp%20(1).webp,,false
1281131434,Works with YubiKey catalog,,"Explore the Works With YubiKey Catalog to find a wide range of applications that support YubiKeys. The YubiKey, Yubico’s security key, keeps your data secure.",https://www.yubico.com/works-with-yubikey/catalog/?sort=popular,"Tools, Yubico",2025-08-03T04:15:43.836Z,https://resources.yubico.com/53ZDUYE6/at/tjtrsr2xjk9bp3ht3633thgx/WWYK_Listings_Pages_Opengraph_image.jpg?auto=webp&format=png,,false
1281131367,Automation Trade Shows in United States,,Automation Trade Shows in United States. Calendar Automation Trade Shows in major cities of United States,https://www.ntradeshows.com/automation/united-states,Industrial Automation,2025-08-03T04:15:23.989Z,https://images.neventum.com/logos/2016/195/160/578767bd5eff3-56a9fce6d14a7-atx-south_9ebf5444.jpg,,false
1281131271,Find Your Next DIY Project at Construct101,,"Find DIY projects, free woodworking plans, and home improvement tips. Build your next project with our easy to follow plans.",https://www.construct101.com/,"Building, Wood",2025-08-03T04:15:00.644Z,https://www.construct101.com/wp-content/uploads/2025/06/12x16-Barn-Shed-Plans-DIY-Build-Project-310x205.png,,false
1281131108,netool.io Pro2 – netool.io,,,https://netool.io/pro/,"Networking, Tools",2025-08-03T04:14:07.022Z,https://netool.io/wp-content/uploads/2023/03/netoolpro2scrollpick-scaled.jpg,,false
1281131034,Pentest Tools & Media | Hak5 Official Site,,"Hak5 — industry leading hacker tools & award winning hacking shows for red teams, pentesters, cyber security students and IT professionals. Creators of the WiFi Pineapple, USB Rubber Ducky & more. Home to an inclusive information security community. Established in 2005.",https://shop.hak5.org/,"Cybersecurity, Tools, Pentester",2025-08-03T04:13:43.682Z,https://shop.hak5.org/cdn/shop/files/hak5-logo-transparent-500x500_1200x.png?v=1645131289,,false
1281130967,Ultimate Maurauder | The Wired Hatters,,"Introducing the custom Ultimate-Marauder Board by Billi Green The Wired Hatters. This advanced board comes with a 3D printed case .This device is compatible with the Flipper Zero. (Disclaimer below)Dual ESP32 Chips:The board features two ESP32 chips for enhanced performance.ESP32-WROOM-UE:Dedicated to managing the touch screen interface running Marauder.ESP32-WROVER:Controlled by the Flipper Zero for seamless integration.Independent GPS Functionality:The onboard GPS can only operate independently, depending on which ESP32 chip it is switched to.Pre-Flashed Firmware:Both the WROOM and WROVER chips come pre-flashed with the latest Marauder firmware.Easy Firmware Updates: Update instructions are available on the FzeeFlasher page. Use the orange port to program the ESP32-WROVER connected to the Flipper, and the blue port for the ESP32-WROOM connected to the touch screen. Package IncludesUltimate Marauder PCB x13D Printed Case x1External 2.4GHz Antenna x2Internal Ceramic GPS Antenna x1Screws x3 Key Features:Wi-Fi Scanning and MonitoringPacket Sniffing and InjectionAccess Point DetectionEvil PortalSSID CloningBeacon SpammingInterface and Control:User-friendly interface with an LCD display for easy operation.Touch screen control for intuitive and straightforward navigation.Upgrade your network security toolkit with the ESP32 Marauder and stay ahead of potential threats and vulnerabilities. All modules are thoroughly tested before shipping to ensure they are fully functional.If you encounter any issues while setting up the module, please do not hesitate to contact me! ⚠️ Disclaimer ⚠️This hardware is for educational and experimental purposes only and is not meant for any illegal activity or purposes.I do not condone illegal activity and strongly encourage keeping transmissions to legal or valid educational or experimental uses allowed by law. Please be advised that the products sold here are third-party items compatible with the Flipper Zero. These products are not manufactured, endorsed, or affiliated with Flipper Devices Inc. in any way. The use of the “Flipper” or “Flipper Zero” name in our product descriptions is solely for identification purposes — to demonstrate the compatibility of our products with the mentioned device.",https://www.wiredhatters.com/product-page/ultimate-maurauder,"Cybersecurity, Tools, Flipper",2025-08-03T04:13:21.576Z,"https://static.wixstatic.com/media/35ea10_c352ea38cf4c4ba0982a44c7b898755d~mv2.jpg/v1/fit/w_500,h_500,q_90/file.jpg",,false
1281130916,Arduino Project Hub,,Arduino Project Hub is a website for sharing tutorials and descriptions of projects made with Arduino boards,https://projecthub.arduino.cc/,"Electrical, Arduino, Building",2025-08-03T04:13:05.171Z,https://assets.arduinocontent.cc/Banner%20AI%20desktop.png,,false
1281130818,Home Improvement and Remodeling,,How-to and DIY expert advice from America's most trusted home improvement brand.,https://www.thisoldhouse.com/,"Home, Repair",2025-08-03T04:12:26.588Z,https://www.thisoldhouse.com/wp-content/uploads/2020/10/CoreFour-Mix1-TOH-Talent_09232020MP-2357-Edit_Core_4_Newsletter_Tout__10-2-20_.0.jpg,,false
1281130775,Free Playhouse & Playset Plans,,Build a fun playhouse on a budget with our 17 free DIY plans. Explore simple designs and detailed instructions to create a magical play space for your kids.,https://paulsplayhouses.com/collections/free-playhouse-plans,"Building, Wood",2025-08-03T04:12:11.752Z,http://paulsplayhouses.com/cdn/shop/collections/swingset_plan_1200x1200.jpeg?v=1618964757,,false
1281130750,DIY Home Improvement Information | DoItYourself.com,,"Do it yourself home improvement and diy repair at Doityourself.com. Includes home improvement projects, home repair, kitchen remodeling, plumbing, electrical, painting, real estate, and decorating.",https://www.doityourself.com/,"Home, Repair",2025-08-03T04:12:02.847Z,https://cimg2.ibsrv.net/cimg/www.doityourself.com/600x500_85-1/494/Heat-Pump-Replacement-Mistakes-to-Avoid-489494.jpg.webp,,false
1281130708,Free DIY and Woodworking Plans - Build Blueprint,,"Free DIY and woodworking plans, with detailed step-by-step instructions. Learn how to build dog kennels, sheds, furniture, and more!",https://buildblueprint.com/,"Building, Wood",2025-08-03T04:11:48.640Z,https://buildblueprint.com/wp-content/uploads/2020/08/8x10-Garden-Shed-12.jpg,,false
1281130632,DigiKey Home,,"DigiKey is your go-to source for millions of electronic components, many in-stock quantities, fast shipping, and expert support. From design to production, we get technical to help you innovate.",https://www.digikey.com/,"Electrical, Building",2025-08-03T04:11:30.382Z,https://sc-a.digikeyassets.com/-/media/Images/Header/DigiKey_rgb_600x600.png?la=en-US&ts=88c6251c-ba44-4c88-ac2d-d52e8cc4af42,,false
1281130598,LCSC Electronics - Electronic Components Distributor,,"LCSC Electronics is a Global Electronic Components Distributor, offering 560,000 in-stock SKUs from 2,600+ manufacturers alongside cost-effective Asian Domestic Alternatives. We provide Custom Cable Assemblies & Wire Harnesses, Acrylic & PET Front Panel, PCBA, and PCB prototype manufacturing, delivering innovative supply chain support to engineers and businesses worldwide.",https://lcsc.com/,"Electrical, Building",2025-08-03T04:11:21.849Z,https://assets.lcsc.com/crm/attachment/20250627/0449A19F158BFF23B676095A137933991750991681701.jpg,,false
1281130555,Yours for the making,,"Instructables is a community for people who like to make things. Come explore, share, and make your next project with us!",https://www.instructables.com/,"Building, Electrical",2025-08-03T04:11:08.485Z,https://images.ctfassets.net/jl5ii4oqrdmc/1W7w2eQdy5YgEkfx9fJIAj/d9f96c948ee4223d1cf70794ab1e622b/2400x900-fta.jpg,,false
1281130449,Great Scott Gadgets,,,https://greatscottgadgets.com/,"Cybersecurity, Tools",2025-08-03T04:10:35.214Z,https://greatscottgadgets.com/images/gsglogosolid.png,,false
1281130396,Proxmox Server Solutions,,"Proxmox develops powerful and efficient open-source server solutions like the Proxmox VE platform, Proxmox Backup Server, and Proxmox Mail Gateway.",https://www.proxmox.com/en/,"Servers, Home",2025-08-03T04:10:23.660Z,https://proxmox.com/images/proxmox/Proxmox-logo-stacked-1240.png,,false
1281130357,Home - Rabbit-Labs,,Rabbit-Labs was built upon the true“hacker mindset” Rabbit-Labs is a collective of great minds. Rabbit-Labs is the gathering of people […],https://rabbit-labs.com/?v=0b3b97fa6688,"Cybersecurity, Tools",2025-08-03T04:10:09.416Z,https://rdl.ink/render/https%3A%2F%2Frabbit-labs.com%2F%3Fv%3D0b3b97fa6688,,false
1281129054,"CarEdge | Buy, Sell, and Protect New & Used Cars",,"Founded by Ray and Zach Shefska, CarEdge offers a car buying service & is the best place to buy, sell, insure, finance, and protect your car.",https://caredge.com/,"Automotive, Buying",2025-08-03T04:03:11.232Z,https://caredge.com/wp-content/uploads/2024/09/Facebook-Twitter-1-1024x538.png,,false
1281128995,Rip Clean - Exterior & Interior Car Detailing Cleaning Materials,,"Ripclean is the destination for premium auto detailing solutions. From high-foaming car soaps to ultra absorbent drying towels & the innovative BetterExtractor Hose Kit, we deliver professional-grade results with ease. Experience luxury-level care for your vehicle shop RipClean today for superior shine and performance",https://ripclean.com/,"Automotive, Tools",2025-08-03T04:02:56.648Z,https://ripclean.com/cdn/shop/files/plate_1200x1200_crop_center.png?v=1733769254,,false
1281128946,"AESwave.com, labscopes scan tools and accessories for diagnostic test equipment!",,"Automotive diagnostic equipment sales and support for professional automotive technicians, schools, instructors, and trainers. Services include custom manufacturing and product development.",https://www.aeswave.com/,"Automotive, Tools",2025-08-03T04:02:46.640Z,https://www.aeswave.com/images/aeswave_logo_square_fb.png,,false
1281128905,Performance Car Parts & Accessories,,Your One Stop Shop For Performance Auto Parts. MAPerformance is your aftermarket and OEM parts source for modern turbo vehicles and beyond.,https://www.maperformance.com/,"Vehicle, Parts",2025-08-03T04:02:34.313Z,https://www.maperformance.com/cdn/shop/files/2024-10-22-MAP-GENERAL-HERO-1600x500-05-V1_1.webp?v=1750948482&width=1080,,false
1281128847,ManualsLib - Makes it easy to find manuals online!,,,https://www.manualslib.com/,"Vehicle, Data Dumps, Manual",2025-08-03T04:02:23.843Z,https://static.manualslib.com/public/img/manuallib_logo_large_en.png,,false
