id,title,note,excerpt,url,tags,created,cover,highlights,favorite
1281114099,Operation Privacy,,A DIY dashboard: Because it's personal.,https://www.operationprivacy.com/,"Privacy, Tools",2025-08-03T03:22:02.879Z,https://www.operationprivacy.com/img/favicon/apple-touch-icon.png?v=1,,false
1281113978,All You Need to Know About Cookies | Cookiepedia,,Cookiepedia is all about cookies and online tracking. We categorise cookies and host domains to enable people to make informed online privacy choices.,https://cookiepedia.co.uk/,"DNS, Data Dumps",2025-08-03T03:21:32.526Z,https://cookiepedia.co.uk/Images/1-full.png,,false
1281113783,LibRedirect - Privacy-friendly Redirector,,"A web extension that redirects YouTube, Twitter, Instagram, etc. requests to alternative privacy-friendly frontends",https://libredirect.github.io/,"Websites, Alternatives",2025-08-03T03:20:43.157Z,,,false
1281113560,Cover Your Tracks,,See how trackers view your browser,https://coveryourtracks.eff.org/,"Privacy, Tools, Websites",2025-08-03T03:19:37.357Z,https://coveryourtracks.eff.org/static/images/cyt-banner.png,,false
1281113483,Pentester,,Pentester is a powerful software application designed for comprehensive security testing and penetration testing.,https://pentester.com/services/,"Cybersecurity, Networking",2025-08-03T03:19:16.080Z,https://pentester.com/img/risks_light.svg,,false
1281113398,Privacy Tools List by CHEF-KOCH,,The biggest privacy resource list you can find on the entire Internet.,https://chef-koch.bearblog.dev/privacy-tools-list-by-chef-koch/,"Privacy, Tools",2025-08-03T03:18:47.491Z,https://i.ibb.co/cYFR50R/thumb2-fsociety-mask-4k-black-background.jpg,,false
1281113338,"Privacy and Security Guides, News, VPN Information and Reviews",,BeEncrypted reviews privacy tools and provides information to secure your identity and data on the web. We also help you enjoy the internet to the fullest.,https://beencrypted.com/,"Learning, Privacy",2025-08-03T03:18:24.315Z,https://beencrypted.com/app/uploads/levels.png,,false
1281113252,Am I FLoCed?,,This page will check whether Google Chrome's experimental new ad-targeting technology is enabled in your browser.,https://amifloced.org/,"Privacy, Tools, Websites",2025-08-03T03:17:53.092Z,https://amifloced.org/images/floc-4b.gif,,false
1281113103,The ultimate F-Droid setup (300+ Apps),,,https://alternativeto.net/lists/28655/the-ultimate-f-droid-setup/,"Apps, Moblie",2025-08-03T03:17:36.123Z,https://d4.alternativeto.net/RgDf1rqQKT0NH2IDS_IX2MklMj3FHIxvyR12Sd2O26w/fit/1200/630/no/0/YWJzOi8vZGlzdC9zdGF0aWMvZ2Z4L2FsdDItb2cucG5n.jpg,,false
1281113044,Home - εxodus,,The privacy audit platform for Android applications,https://reports.exodus-privacy.eu.org/en/,"Privacy, Moblie, Tools",2025-08-03T03:17:17.696Z,http://reports.exodus-privacy.eu.org/static/img/logo_purple_without_text.png,,false
1281112866,Just Delete Me | A directory of direct links to delete your account from web services.,,,https://backgroundchecks.org/justdeleteme/,"Privacy, Tools",2025-08-03T03:16:57.713Z,https://rdl.ink/render/https%3A%2F%2Fbackgroundchecks.org%2Fjustdeleteme%2F,,false
1281112744,IP/DNS Detect,,"What is your IP, what is your DNS, check your torrent IP, what informations you send to websites.",https://ipleak.net/,"Privacy, Tools, IP Address",2025-08-03T03:16:40.789Z,https://ipleak.net/static/images/logo.png,,false
1281112558,Terms of Service; Didn't Read,,We help you understand Terms of Service and Privacy Policies,https://tosdr.org/en,Terms of Service,2025-08-03T03:15:49.798Z,https://s3.tosdr.org/branding/tosdr-thumb-big.png,,false
1281112468,ShutUpTrackers,,Protection against mass surveillance and spying,https://shutuptrackers.com/,"Privacy, Tools",2025-08-03T03:15:26.990Z,https://rdl.ink/render/https%3A%2F%2Fshutuptrackers.com%2F,,false
1281112084,All Projects - PRISM Break,,"Opt out of global data surveillance programs like PRISM, XKeyscore and Tempora. Help make mass surveillance of entire populations uneconomical! We all have a right to privacy, which you can exercise today by encrypting your communications and ending your reliance on proprietary services.",https://prism-break.org/en/all/,"Privacy, Tools",2025-08-03T03:14:11.672Z,https://rdl.ink/render/https%3A%2F%2Fprism-break.org%2Fen%2Fall%2F,,false
1281112047,AdBlock Tester: test your AdBlock extensions,,"Website with ads, analytics trackers, metrics, error catchers. Check your blocker: AdBlock, AdBlock Plus, AdGuard, Ghostery, uBlock Origin, AdBlocker Ultimate…",https://adblock-tester.com/,"Tools, Websites, Privacy",2025-08-03T03:13:57.458Z,https://rdl.ink/render/https%3A%2F%2Fadblock-tester.com%2F,,false
1281111955,Privacy Test & Analyzer: See what information websites know about you,,"You might be surprised just what information a website knows about you. This can include your browser, other websites you are logged in to and even your IP address.",https://privacy.net/analyzer/#pre-load,"Privacy, Tools, Browser",2025-08-03T03:13:24.607Z,https://rdl.ink/render/https%3A%2F%2Fprivacy.net%2Fanalyzer%2F%23pre-load,,false
1281111908,Buying a house | Consumer Financial Protection Bureau,,Choosing the right home loan is just as important as choosing the right home. Use our tools and resources to know what to expect every step of the way.,https://www.consumerfinance.gov/owning-a-home/,"Home, Tools",2025-08-03T03:13:07.485Z,https://files.consumerfinance.gov/f/images/ask-cfpb-social-mortgages.original.png,,false
1281111861,Autoruns - Sysinternals,,See what programs are configured to startup automatically when your system boots and you login.,https://learn.microsoft.com/en-us/sysinternals/downloads/autoruns,"Tools, Windows",2025-08-03T03:12:47.815Z,https://learn.microsoft.com/en-us/media/open-graph-image.png,,false
1281111818,TCPView for Windows - Sysinternals,,Active socket command-line viewer.,https://learn.microsoft.com/en-us/sysinternals/downloads/tcpview,"Tools, Windows",2025-08-03T03:12:36.644Z,https://learn.microsoft.com/en-us/media/open-graph-image.png,,false
1281111782,Process Explorer - Sysinternals,,"Find out what files, registry keys and other objects processes have open, which DLLs they have loaded, and more.",https://learn.microsoft.com/en-us/sysinternals/downloads/process-explorer,"Tools, Windows",2025-08-03T03:12:24.623Z,https://learn.microsoft.com/en-us/media/open-graph-image.png,,false
1281111628,LOLBAS,,,https://lolbas-project.github.io/#,"Cybersecurity, Living off The Land",2025-08-03T03:11:35.064Z,https://lolbas-project.github.io/assets/logo.png,,false
1281111555,Ethical Hacker,,Become an ethical hacker and build your offensive security skills in this free online course - from Cisco Networking Academy. Sign up today!,https://www.netacad.com/courses/ethical-hacker?courseLang=en-US,"Learning, Cybersecurity",2025-08-03T03:11:12.389Z,https://netacad.com/p/ff9e491c-49be-4734-803e-a79e6e83dab1/fc550241-ee17-45d1-87dd-1046b6aeb89a/image.png,,false
1281111505,Homepage - Just Hacking Training (JHT),,"Just Hacking provides ""Focused Technical Training for All Levels"" with 4 types of affordable, hands-on options by John Hammond & All-Stars.",https://www.justhacking.com/,"Learning, Cybersecurity",2025-08-03T03:10:54.906Z,https://www.justhacking.com/wp-content/uploads/JHT_Logo03-600x600-1.png,,false
1281111467,picoCTF - CMU Cybersecurity Competition,,picoCTF is a free computer security education program with original content built on a capture-the-flag framework created by security and privacy experts at Carnegie Mellon University.,https://picoctf.com/,"Learning, Cybersecurity",2025-08-03T03:10:40.646Z,https://picoctf.org/img/logos/picoctf-logo-social.png,,false
1281111430,CTF Handbook,,Capture the Flag Competition Wiki,https://ctf101.org/,"Cybersecurity, Learning",2025-08-03T03:10:30.581Z,https://rdl.ink/render/https%3A%2F%2Fctf101.org%2F,,false
1281111387,Mobile Security Framework (MobSF),,"Mobile Security Framework (MobSF) is an automated, all-in-one mobile application (Android/iOS/Windows) pen-testing, malware analysis and security assessment framework capable of performing static and dynamic analysis.",https://mobsf.github.io/Mobile-Security-Framework-MobSF/,"Cybersecurity, Moblie",2025-08-03T03:10:15.225Z,https://cloud.githubusercontent.com/assets/4301109/20019521/cc61f7fc-a2f2-11e6-95f3-407030d9fdde.png,,false
1281111322,Fuzzing | OWASP Foundation,,Fuzzing on the main website for The OWASP Foundation. OWASP is a nonprofit foundation that works to improve the security of software.,https://owasp.org/www-community/Fuzzing#,"Cybersecurity, Fuzzing",2025-08-03T03:09:50.732Z,https://owasp.org/www--site-theme/favicon.ico,,false
1281111227,ExifTool by Phil Harvey,,"A command-line application and Perl library for
  reading and writing EXIF, GPS, IPTC, XMP, makernotes and other meta information
  in image, audio and video files.  For Windows, MacOS, and Unix systems.",https://exiftool.org/,"Cybersecurity, Meta Data",2025-08-03T03:09:22.177Z,https://exiftool.org/ET-256.png,,false
1281111179,ANY.RUN - Dynamic Malware Analysis Sandbox,,Explore more about ANY.RUN's malware analysis tools for dynamic detection and threat research.,https://any.run/features/,"Cybersecurity, Analyzer",2025-08-03T03:09:04.214Z,https://any.run/img/logo-anyrun.png,,false
1281111075,CyberChef,,"The Cyber Swiss Army Knife - a web app for encryption, encoding, compression and data analysis",https://cyberchef.org/,"Cybersecurity, Tools",2025-08-03T03:08:29.940Z,https://rdl.ink/render/https%3A%2F%2Fcyberchef.org%2F,,false
1281111021,Aircrack-ng,,,https://www.aircrack-ng.org/,"Cybersecurity, Wifi",2025-08-03T03:08:10.201Z,https://www.aircrack-ng.org/resources/aircrack-ng-new-logo.jpg,,false
1281110993,dotPeek: Free .NET Decompiler & Assembly Browser by JetBrains,,dotPeek is a free tool based on ReSharper. It can reliably decompile any .NET assembly into C# or IL code.,https://www.jetbrains.com/decompiler/,Decompiler,2025-08-03T03:08:00.262Z,https://resources.jetbrains.com/storage/products/dotpeek/img/meta/preview.png,,false
1281110837,MITRE ATT&CK®,,,https://attack.mitre.org/,"Cybersecurity, MITRE",2025-08-03T03:07:00.067Z,https://rdl.ink/render/https%3A%2F%2Fattack.mitre.org%2F,,false
1281110780,"Metasploit | Penetration Testing Software, Pen Testing Security | Metasploit",,"Find security issues, verify vulnerability mitigations & manage security assessments with Metasploit. Get the world's best penetration testing software now.",https://www.metasploit.com/,"Cybersecurity, Metasploit",2025-08-03T03:06:41.238Z,https://www.metasploit.com/includes/images/metasploit-og.png,,false
1281110740,Deep Hat,,WhiteRabbitNeo is now Deep Hat – a Generative AI Large Language Model (LLM) designed to support DevSecOps professionals in use cases for offensive and defensive cybersecurity...,https://www.deephat.ai/,LLM's,2025-08-03T03:06:22.719Z,https://cdn.prod.website-files.com/687e6933d543cacde5908701/687e6933d543cacde5908838_4e34b5a8fc5f18017b42c911ae848673_Open%20Graph%20-%201200x630px.png,,false
1281110693,ATT&CK® Navigator,,,https://mitre-attack.github.io/attack-navigator/,"Cybersecurity, MITRE",2025-08-03T03:06:09.407Z,https://rdl.ink/render/https%3A%2F%2Fmitre-attack.github.io%2Fattack-navigator%2F,,false
1281110636,BugMeNot: share logins.,,Access and share logins for websites that require you to register in order to view content.,https://bugmenot.com/,"Cybersecurity, Websites, Data Dumps",2025-08-03T03:05:54.289Z,https://rdl.ink/render/https%3A%2F%2Fbugmenot.com%2F,,false
1281110462,Reverse Shell Cheat Sheet - Internal All The Things,,Active Directory and Internal Pentest Cheatsheets,https://swisskyrepo.github.io/InternalAllTheThings/cheatsheets/shell-reverse-cheatsheet/,"Cybersecurity, Cheatsheet, Reverse Shell",2025-08-03T03:04:58.374Z,https://swisskyrepo.github.io/InternalAllTheThings/assets/images/social/cheatsheets/shell-reverse-cheatsheet.png,,false
1281110385,hashcat - advanced password recovery,,World's fastest and most advanced password recovery utility,https://hashcat.net/hashcat/,"Cybersecurity, Passwords",2025-08-03T03:04:28.880Z,https://hashcat.net/hashcat/hashcat700.png,,false
1281110219,sqlmap: automatic SQL injection and database takeover tool,,,https://sqlmap.org/,"Cybersecurity, SQL",2025-08-03T03:03:42.250Z,https://sqlmap.org/images/screenshot.png,,false
1281110163,"Zamzar - video converter, audio converter, image converter, eBook converter",,"Free online video converter, audio converter, image converter, eBook converter. No download or account required.",https://www.zamzar.com/,"Files, Tools",2025-08-03T03:03:25.286Z,https://rdl.ink/render/https%3A%2F%2Fwww.zamzar.com%2F,,false
1281110126,CloudConvert,,"File converter service - more than 200 different audio, video, document, ebook, archive, image, spreadsheet and presentation formats supported.",https://cloudconvert.com/,"Files, Tools",2025-08-03T03:03:11.236Z,https://rdl.ink/render/https%3A%2F%2Fcloudconvert.com%2F,,false
1281081674,432Hz Music Converter | Conversion-Tool.com,,Use this tool to convert music to 432Hz (Hertz).,https://www.conversion-tool.com/,"Files, Tools",2025-08-03T02:02:57.767Z,https://www.conversion-tool.com/wp-content/uploads/2018/11/music.png,,false
1281081620,"Free AI Writing, PDF, Image, and other Online Tools - TinyWow",,,https://tinywow.com/,"Files, Tools",2025-08-03T02:02:41.331Z,https://tinywow.com/v3/img/shadow.png,,false
1281081545,90+ Free PDF Tools Online – PDF Candy,,"Process PDF files with PDF Candy - a free online PDF toolkit. Edit PDF, convert PDF to Word, PDF to JPG, merge and split PDF, compress PDF, etc.",https://pdfcandy.com/,"Files, Tools",2025-08-03T02:02:17.111Z,https://pdfcandy.com/images/extra/fb.png,,false
1281081515,Convert Web Page to PDF for Free Online - #1 Web to PDF Converter,,Easily convert web page to PDF using free online converter.,https://www.web2pdfconvert.com/,"Files, Tools",2025-08-03T02:02:09.997Z,https://www.web2pdfconvert.com/img/w2p-social.png,,false
1281081445,Unit Converter,,"Quick, free, online unit converter that converts common units of measurement, along with 77 other converters covering an assortment of units. The site also includes a predictive tool that suggests possible conversions based on input, allowing for easier navigation while learning more about various unit systems.",https://www.unitconverters.net/,"Tools, Mathmatics",2025-08-03T02:01:49.896Z,https://rdl.ink/render/https%3A%2F%2Fwww.unitconverters.net%2F,,false
1281081279,VirusTotal - Home,,,https://www.virustotal.com/gui/home/upload,"URL, Cybersecurity",2025-08-03T02:01:08.422Z,https://rdl.ink/render/https%3A%2F%2Fwww.virustotal.com%2Fgui%2Fhome%2Fupload,,false
1281081248,Cashback Comparison & Miles/Points Reward Comparison,,"Cashback, Rebates, Airline Miles/Points Reward, Hotel Points Reward,
					 Credit Card Points Reward Comparison for Online Shopping",https://www.cashbackmonitor.com/,Cash Back,2025-08-03T02:00:57.418Z,https://www.cashbackmonitor.com/img/cbm2r.gif,,false
1281081213,Live Flight Tracker - Real-Time Flight Tracker Map | Flightradar24,,The world’s most popular flight tracker. Track planes in real-time on our flight tracker map and get up-to-date flight status &amp; airport information.,"https://www.flightradar24.com/43.00,24.35/7",Flights,2025-08-03T02:00:45.939Z,https://images.flightradar24.com/opengraph/fr24_logo_twitter.png,,false
1281081146,Password Pusher,,"Securely communicate passwords, data & files. Secret URLs expire after X views or X days. Track access with audit logs.",https://eu.pwpush.com/,"Files, Sharing",2025-08-03T02:00:27.205Z,https://pwpush.fra1.cdn.digitaloceanspaces.com/branding/logos/square-logo-small.png,,false
1281081090,OnionShare,,"OnionShare is a tool for anonymous peer-to-peer file sharing, chatting, and web hosting.",https://onionshare.org/,"Files, Sharing",2025-08-03T02:00:11.572Z,https://onionshare.org/design-system/images/cover.png,,false
1281081037,DNS Checker - DNS Check Propagation Tool,,Check DNS Propagation worldwide. DNS Checker provides name server propagation check instantly. Changed nameservers so do a DNS lookup and check if DNS and nameservers have propagated.,https://dnschecker.org/,"Cybersecurity, DNS",2025-08-03T01:59:53.350Z,https://static.dnschecker.org/og-images/DNS-CHECKER-Main-Page.png,,false
1281080973,MX Lookup Tool - Check your DNS MX Records online - MxToolbox,,,https://mxtoolbox.com/,"Cybersecurity, DNS",2025-08-03T01:59:34.660Z,https://rdl.ink/render/https%3A%2F%2Fmxtoolbox.com%2F,,false
1281080863,Censys Search,,"Censys helps organizations, individuals, and researchers find and monitor every server on the Internet to reduce exposure and improve security.",https://search.censys.io/,"Cybersecurity, DNS",2025-08-03T01:59:05.673Z,https://search.censys.io/static/img/censys-mark-2025.png,,false
1281080744,Check if a Website is Malicious/Scam or Safe/Legit | URLVoid,,Free website reputation checker tool lets you scan a website with multiple website reputation/blocklist services to check if the website is safe and legit or malicious. Check the online reputation of a website to better detect potentially malicious and scam websites.,https://www.urlvoid.com/,"URL, Cybersecurity",2025-08-03T01:58:31.621Z,https://www.urlvoid.com/images/fb-image.png,,false
1281080634,TinEye - Reverse Image Search and Recognition,,Easily find where images appear online. TinEye keeps your searches private.,https://tineye.com/,Search Engine,2025-08-03T01:57:59.960Z,https://tineye.com/assets/touch_icons/touch-icon-192x192.png,,false
1281080544,List of academic databases and search engines - Wikipedia,,,https://en.wikipedia.org/wiki/List_of_academic_databases_and_search_engines,"Search Engine, Data Dumps",2025-08-03T01:57:37.179Z,https://rdl.ink/render/https%3A%2F%2Fen.wikipedia.org%2Fwiki%2FList_of_academic_databases_and_search_engines,,false
1281080474,Code Search | Grep by Vercel,,"Effortlessly search for code, files, and paths across a million GitHub repositories.",https://grep.app/,"Programming, Search Engine",2025-08-03T01:57:13.558Z,https://grep.app/opengraph-image.png?7418db2edff03759,,false
1281080430,Redirect Detective - Discover where those redirects really go to,,,https://redirectdetective.com/,"URL, Cybersecurity",2025-08-03T01:56:57.262Z,,,false
1281080365,Shodan,,Search engine of Internet-connected devices. Create a free account to get started.,https://www.shodan.io/,"Cybersecurity, Networking, Search Engine",2025-08-03T01:56:37.754Z,https://www.shodan.io/static/img/opengraph.png,,false
1281080283,Reverse Wallpaper Engine Search,,A tool to reverse image search wallpaper engine images,https://we-img-search.ordinall.me/,Search Engine,2025-08-03T01:56:19.635Z,https://rdl.ink/render/https%3A%2F%2Fwe-img-search.ordinall.me%2F,,false
1281080210,Ninite - Install or Update Multiple Apps at Once,,"The easiest, fastest way to update or install software. Ninite downloads and installs programs automatically in the background.",https://ninite.com/,"Downloader, Software",2025-08-03T01:55:59.579Z,https://ninite.com/static/img/screenshot-d19f898aea36be8dcd93c3af7de4abb0.png,,false
1281080174,TikTok Downloader - Download TikTok Videos Without Watermark,,(2023) Best TikTok video downloader! Now download your favorite TikTok videos with or without watermark (no logo) for free & save them in MP4 using TKVDL.,https://ttvdl.com/,Downloader,2025-08-03T01:55:47.967Z,https://rdl.ink/render/https%3A%2F%2Fttvdl.com%2F,,false
1281080132,The Engineering ToolBox,,Free tools and information for engineering and design of technical applications.,https://www.engineeringtoolbox.com/,"Science / Engineering, Tools",2025-08-03T01:55:34.849Z,https://www.engineeringtoolbox.com/static/img/logo.jpg,,false
1281080057,Free Online Calculators,,"Find free loan, mortgage, time value of money, math, algebra, trig, fractions, physics, statistics, time & date and conversions calculators here!",https://www.calculatorsoup.com/,"Tools, Mathmatics",2025-08-03T01:55:14.095Z,https://cdn.calculatorsoup.com/images/thumbnails/calculator_soup_logo_260x260.png,,false
1281080017,Calcresource: home of online calculation tools,,"Home page of calcresource.com. Catalogue of all calculation tools and unit converters available, indexed by category.",https://calcresource.com/index.html,"Mathmatics, Tools",2025-08-03T01:55:03.261Z,https://rdl.ink/render/https%3A%2F%2Fcalcresource.com%2Findex.html,,false
1281079977,Engineering Library,,Engineering library provides a convenient and comprehensive set of reference material for engineers.,https://engineeringlibrary.org/,Science / Engineering,2025-08-03T01:54:49.296Z,https://engineeringlibrary.org/static/img/Home/prague-980732_1280.jpg,,false
1281079898,All Online Tools in One Box | 10015 Tools,,"All online tools you need in one box for free. Build anything online with “all-in-one toolbox”. All tools are easy-to-use, blazing fast & free.",https://10015.io/,Tools,2025-08-03T01:54:30.380Z,https://10015.io/og-image.jpg,,false
1281079792,Programmable Logic Controller Training Courses & Manuals | PLC Profess,,"Home of the PLC Professor   

Dedicated to providing the lowest learning cost without compromising the learning goal. Finding the least expensive hands-on hardware platform.


Our desire is to give y",https://www.plcprofessor.com/,"Textbooks, Industrial Automation",2025-08-03T01:53:57.923Z,https://cdn.shopify.com/s/files/1/1178/7298/files/checkout_logo_1.png?height=628&pad_color=ffffff&v=1613150697&width=1200,,false
1281079748,Open Circuits,,,https://www.opencircuitsbook.com/#oc-book,"Textbooks, Electrical",2025-08-03T01:53:43.109Z,https://www.opencircuitsbook.com/assets/img/oc_med/1.jpg,,false
1281079663,System Programming in Linux,,Learn to write real Linux software—not just run it.,https://nostarch.com/introduction-system-programming-linux,"Textbooks, Linux",2025-08-03T01:53:13.417Z,https://nostarch.com/sites/default/files/SystemProgrammingLinux_frontcover.png,,false
1281079620,"ZLibrary – Download Free eBooks, PDFs & Textbooks Online",,"Access millions of free eBooks and academic papers with ZLibrary. Download books in PDF, EPUB, and MOBI formats. Learn how to use ZLibrary and get started today!",https://www.zlibrary.to/,Textbooks,2025-08-03T01:52:58.785Z,https://www.zlibrary.to/images/thumbnail.png,,false
1281079469,22 Free Data Science Books,,"22 free data science books for the aspirational data scientist, covering statistics, Python, machine learning, the data science process, and more.",https://www.wzchen.com/data-science-books,Textbooks,2025-08-03T01:52:07.695Z,https://rdl.ink/render/https%3A%2F%2Fwww.wzchen.com%2Fdata-science-books,,false
1281079409,Manning Publications,,"Manning is an independent publisher of computer books, videos, and courses.",https://www.manning.com/,Textbooks,2025-08-03T01:51:44.569Z,https://www.manning.com/assets/defaultTwitterCard-d210aa87bc328de9c9999dfa5f0b76de.png,,false
1281079382,The Online Books Page,,,https://digital.library.upenn.edu/books/,"Textbooks, Data Dumps",2025-08-03T01:51:34.874Z,https://rdl.ink/render/https%3A%2F%2Fdigital.library.upenn.edu%2Fbooks%2F,,false
1281079016,"Free / Open Acess Online Computer Science Books, Textbooks, and Lecture Notes",,"This site lists free online computer science, engineering and programming books, textbooks and lecture notes, all of which are legally and freely available.",https://www.freetechbooks.com/,"Textbooks, Data Dumps",2025-08-03T01:50:56.961Z,https://www.freetechbooks.com/uploads/logo_left.gif,,false
1281078981,Hacker News Books,,Top books mentioned in comments on Hacker News delivered to you in a weekly newsletter.,https://hackernewsbooks.com/,Textbooks,2025-08-03T01:50:44.381Z,https://static.hackernewsbooks.com/hnb_icon_220x220.png,,false
1281078936,"Anna’s Archive: LibGen (Library Genesis), Sci-Hub, Z-Library in one place - Anna’s Archive",,"The world’s largest open-source open-data library. Mirrors Sci-Hub, Library Genesis, Z-Library, and more.",https://annas-archive.org/,"Data Dumps, Textbooks",2025-08-03T01:50:30.768Z,https://rdl.ink/render/https%3A%2F%2Fannas-archive.org%2F,,false
1281078911,"Free Computer, Programming, Mathematics, Technical Books, Lecture Notes and Tutorials",,"Links to Free Programming, Computer, Mathematics, Technical eBooks and Lecture Notes all over the World, Directory of online free programming, computer, engineering, mathematics, technical books, ebooks, lecture notes and tutorials. Very well categorized. Equipped with advanced search engines.",https://freecomputerbooks.com/,"Computers, Textbooks",2025-08-03T01:50:19.256Z,https://rdl.ink/render/https%3A%2F%2Ffreecomputerbooks.com%2F,,false
1281076045,Wikibooks,,,https://en.wikibooks.org/wiki/Main_Page,Textbooks,2025-08-03T01:49:59.885Z,https://upload.wikimedia.org/wikipedia/commons/thumb/b/b9/Lateral_head_anatomy_detail.png/250px-Lateral_head_anatomy_detail.png,,false
1281076007,Library Genesis,,,https://libgen.gs/,"Data Dumps, Textbooks",2025-08-03T01:49:45.415Z,https://rdl.ink/render/https%3A%2F%2Flibgen.gs%2F,,false
1281075969,Computer Engineering for Babies,,"Computer Engineering for Babies is an interactive board book featuring buttons and lights to introduce basic computer logic gates. If you have a baby, friend, or co-worker that skipped ECE 150 then you should probably pick one of these up.",https://computerengineeringforbabies.com/,"Textbooks, Child",2025-08-03T01:49:31.271Z,http://computerengineeringforbabies.com/cdn/shop/files/xor_feet_sized.jpg?v=1651954747,,false
1281075773,"Textbooks, Computer Science",,"Textbooks published by the MIT Press, topic Computer Science. Machine Learning, Robotics, Programming, General",https://mitpress.mit.edu/textbooks/computer-science/,Textbooks,2025-08-03T01:48:22.692Z,https://mitpress.mit.edu/wp-content/themes/university_press_theme/img/lazy-load-image.jpg,,false
